title,product name,url
Limpador Facial Vichy Normaderm - Época Cosméticos,Normaderm Vichy - Limpador Facial - 60g,https://www.epocacosmeticos.com.br/normaderm-vichy-limpador-facial/p
Limpador Facial Vichy Normaderm - Época Cosméticos,Normaderm Vichy - Limpador Facial - 150g,https://www.epocacosmeticos.com.br/normaderm-vichy-limpador-facial/p
Limpador Facial Vichy Normaderm - Época Cosméticos,Normaderm Vichy - Limpador Facial - 400ml,https://www.epocacosmeticos.com.br/normaderm-vichy-limpador-facial/p
Spray Purificante La Roche-Posay - Serozinc - Época Cosméticos,Spray Purificante La Roche-Posay - Serozinc - 150ml,https://www.epocacosmeticos.com.br/tonico-facial-la-roche-posay-serozinc/p
Sensibio H2O Solução Micellare Demaquilante Bioderma - Demaquilante - Época Cosméticos,Sensibio H2O Solução Micellare Demaquilante Bioderma - Demaquilante - 100ml,https://www.epocacosmeticos.com.br/sensibio-h2o-solucao-micellare-demaquilante-bioderma-demaquilante/p
Sensibio H2O Solução Micellare Demaquilante Bioderma - Demaquilante - Época Cosméticos,Sensibio H2O Solução Micellare Demaquilante Bioderma - Demaquilante - 250ml,https://www.epocacosmeticos.com.br/sensibio-h2o-solucao-micellare-demaquilante-bioderma-demaquilante/p
Sensibio H2O Solução Micellare Demaquilante Bioderma - Demaquilante - Época Cosméticos,Sensibio H2O Solução Micellare Demaquilante Bioderma - Demaquilante - 500ml,https://www.epocacosmeticos.com.br/sensibio-h2o-solucao-micellare-demaquilante-bioderma-demaquilante/p
Effaclar Anti-Idade La Roche Posay - Sérum Corretor para Pele Oleosa - Época Cosméticos,Effaclar Anti-Idade La Roche Posay - Sérum Corretor para Pele Oleosa - 30ml,https://www.epocacosmeticos.com.br/effaclar-anti-idade-la-roche-posay-serum-corretor-para-pele-oleosa/p
Active C10 La Roche Posay - Rejuvenescedor - Época Cosméticos,Active C10 La Roche Posay - Rejuvenescedor Facial - 15ml,https://www.epocacosmeticos.com.br/active-c--10--la-roche-posay-rejuvenescedor-facial/p
Active C10 La Roche Posay - Rejuvenescedor - Época Cosméticos,Active C10 La Roche Posay - Rejuvenescedor Facial - 30ml,https://www.epocacosmeticos.com.br/active-c--10--la-roche-posay-rejuvenescedor-facial/p
Eau Thermale Vicky - Água Termal - Época Cosméticos,Eau Thermale Vichy - Água Termal - 50ml,https://www.epocacosmeticos.com.br/eau-thermale-vichy--agua-termal/p
Eau Thermale Vicky - Água Termal - Época Cosméticos,Eau Thermale Vichy - Água Termal - 150ml,https://www.epocacosmeticos.com.br/eau-thermale-vichy--agua-termal/p
Eau Thermale Vicky - Água Termal - Época Cosméticos,Eau Thermale Vichy - Água Termal - 300ml,https://www.epocacosmeticos.com.br/eau-thermale-vichy--agua-termal/p
Eau Thermale La Roche-Posay - Água Termal - Época Cosméticos,Eau Thermale La Roche-Posay - Água Termal - 150g,https://www.epocacosmeticos.com.br/eau-thermale-la-roche-posay-agua-termal/p
Eau Thermale La Roche-Posay - Água Termal - Época Cosméticos,Eau Thermale La Roche-Posay - Água Termal - 50g,https://www.epocacosmeticos.com.br/eau-thermale-la-roche-posay-agua-termal/p
Eau Thermale La Roche-Posay - Água Termal - Época Cosméticos,Eau Thermale La Roche-Posay - Água Termal - 300g,https://www.epocacosmeticos.com.br/eau-thermale-la-roche-posay-agua-termal/p
Blemish+ Age Defense SkinCeuticals Tratamento Antiacne - Época Cosméticos,Blemish+ Age Defense SkinCeuticals - Tratamento Antiacne - 15ml,https://www.epocacosmeticos.com.br/blemish-age-defense-skinceuticals-tratamento-antiacne/p
Blemish+ Age Defense SkinCeuticals Tratamento Antiacne - Época Cosméticos,Blemish+ Age Defense SkinCeuticals - Tratamento Antiacne - 30ml,https://www.epocacosmeticos.com.br/blemish-age-defense-skinceuticals-tratamento-antiacne/p
Protetor com Cor La Roche-Posay Anthelios Airlicium Fps70 - Época Cosméticos,Protetor Solar Facial com Cor La Roche-Posay - Anthelios Airlicium Fps70 - Clara,https://www.epocacosmeticos.com.br/protetor-solar-facial-com-cor-la-roche-posay-anthelios-airlicium-fps70/p
Protetor com Cor La Roche-Posay Anthelios Airlicium Fps70 - Época Cosméticos,Protetor Solar Facial com Cor La Roche-Posay - Anthelios Airlicium Fps70 - Morena Mais,https://www.epocacosmeticos.com.br/protetor-solar-facial-com-cor-la-roche-posay-anthelios-airlicium-fps70/p
Protetor com Cor La Roche-Posay Anthelios Airlicium Fps70 - Época Cosméticos,Protetor Solar Facial com Cor La Roche-Posay - Anthelios Airlicium Fps70 - Morena,https://www.epocacosmeticos.com.br/protetor-solar-facial-com-cor-la-roche-posay-anthelios-airlicium-fps70/p
Tônico Facial Skinceuticals - Blemish + Age Solution - Época Cosméticos,Tônico Facial Skinceuticals - Blemish + Age Solution - 125ml,https://www.epocacosmeticos.com.br/tonico-facial-skinceuticals-blemish-age-solution/p
Sérum Clareador La Roche-Posay - Pigmentclar Serum - Época Cosméticos,Sérum Clareador La Roche-Posay - Pigmentclar Serum - 20ml,https://www.epocacosmeticos.com.br/serum-antimanchas-la-roche-posay-pigmentclar-serum/p
Hidratante Facial Vichy - Minéral 89 - Época Cosméticos,Hidratante Facial Vichy - Minéral 89 - 50ml,https://www.epocacosmeticos.com.br/hidratante-facial-vichy-mineral-89/p
Rejuvenescedor Facial Vichy Liftactiv Serum 10 Supreme - Época Cosméticos,Rejuvenescedor Facial Vichy Liftactiv Serum 10 Supreme - 30ml,https://www.epocacosmeticos.com.br/rejuvenescedor-facial-vichy-liftactiv-serum-10-supreme/p
Sérum Corretor H.A. Intensifier SkinCeuticals - Rejuvenescedor Facial - Época Cosméticos,Sérum Corretor H.A. Intensifier SkinCeuticals - Rejuvenescedor Facial - 30ml,https://www.epocacosmeticos.com.br/serum-corretor-h-a-intensifier-skinceuticals-rejuvenescedor-facial/p
Protetor Solar Facial Minesol Oil Control FPS 60 Roc - Época Cosméticos,Minesol Oil Control Tinted Fps 60 Roc - Protetor Solar Facial - 50g,https://www.epocacosmeticos.com.br/minesol-oil-control-tinted-fps60-roc-protetor-solar-facial/p
Gel Creme Anti-Idade Ideal Body FPS 20 Vichy - Época Cosméticos,"Ideal Body Pescoço, Colo e Mãos FPS 20 Vichy -  Gel Creme Anti-Idade - 100g",https://www.epocacosmeticos.com.br/ideal-body-pescoco-colo-e-maos-fps-20-vichy-gel-creme-anti-idade/p
Normaderm Skin Corrector Vichy - Cuidado Clareador Antiacne na Black Friday - Época Cosméticos,Normaderm Skin Corrector Vichy - Cuidado Clareador Antiacne - 50ml,https://www.epocacosmeticos.com.br/normaderm-skin-corrector-vichy-cuidado-antiacne-clareador/p
Anthelios Airlicium FPS 70 La Roche Posay - Época Cosméticos,Anthelios Airlicium FPS 70 La Roche Posay - Protetor Solar - 50g,https://www.epocacosmeticos.com.br/anthelios-airlicium-fps-70-la-roche-posay-protetor-solar/p
Effaclar BB Blur La Roche-Posay - Base Facial Corretiva - Época Cosméticos,Effaclar BB Blur La Roche Posay - Base Facial Corretiva - Natural,https://www.epocacosmeticos.com.br/effaclar-bb-blur-la-roche-posay-base-facial-corretiva/p
Anthelios Airlicium FPS 30 La Roche-Posay - Época Cosméticos,Anthelios Airlicium FPS 30 La Roche-Posay - Protetor Solar - 50g,https://www.epocacosmeticos.com.br/anthelios-airlicium-fps-30-la-roche-posay-protetor-solar/p
Effaclar Duo - La Roche-Posay - Época Cosméticos - Época Cosméticos,Effaclar Duo[+] La Roche Posay - Tratamento Antiacne - 40ml,https://www.epocacosmeticos.com.br/effaclar-duo-la-roche-posay-tratamento-antiacne/p
Pigmentclar Eyes La Roche Posay - Época Cosméticos,Pigmentclar Eyes La Roche Posay - Tratamento para o Contorno dos Olhos - 15ml,https://www.epocacosmeticos.com.br/pigmentclar-eyes-la-roche-posay-tratamento-para-o-contorno-dos-olhos/p
Gel Effaclar Concentrado La Roche Posay - Época Cosméticos,Gel Effaclar Concentrado Desincrustante La Roche Posay - Limpador Facial - 150g,https://www.epocacosmeticos.com.br/gel-concentrado-desincrustante-la-roche-posay-limpador-facial/p
Effaclar Gel Alta Tolerância La Roche Posay - Época Cosméticos,Effaclar Gel Alta Tolerância La Roche Posay - Limpador Facial - 60g,https://www.epocacosmeticos.com.br/effaclar-gel-la-roche-posay-limpador-facial/p
Effaclar Gel Alta Tolerância La Roche Posay - Época Cosméticos,Effaclar Gel Alta Tolerância La Roche Posay - Limpador Facial - 150g,https://www.epocacosmeticos.com.br/effaclar-gel-la-roche-posay-limpador-facial/p
Eau Thermale Avène - Água Termal - Época Cosméticos,Eau Thermale Avène - Água Termal - 50ml,https://www.epocacosmeticos.com.br/eau-thermale-avene-agua-termal/p
Eau Thermale Avène - Água Termal - Época Cosméticos,Eau Thermale Avène - Água Termal - 150ml,https://www.epocacosmeticos.com.br/eau-thermale-avene-agua-termal/p
Eau Thermale Avène - Água Termal - Época Cosméticos,Eau Thermale Avène - Água Termal - 300ml,https://www.epocacosmeticos.com.br/eau-thermale-avene-agua-termal/p
Shampoo Dercos Energizante - Vichy - Época Cosméticos,Dercos Shampoo Energizante Vichy - Shampoo para Enfraquecimento Capilar e Queda - 200ml,https://www.epocacosmeticos.com.br/dercos-shampoo-energizante-vichy-shampoo-para-enfraquecimento-capilar-e-queda/p
Shampoo Dercos Energizante - Vichy - Época Cosméticos,Dercos Shampoo Energizante Vichy - Shampoo para Enfraquecimento Capilar e Queda - 400ml,https://www.epocacosmeticos.com.br/dercos-shampoo-energizante-vichy-shampoo-para-enfraquecimento-capilar-e-queda/p
C E Ferulic SkinCeuticals - Sérum Rejuvenescedor Facial - Época Cosméticos,C E Ferulic Skinceuticals - Rejuvenescedor Facial - 30ml,https://www.epocacosmeticos.com.br/c-e-ferulic-skinceuticals-rejuvenescedor-facial/p
Loção Facial Beatriz Dermatus - Época Cosméticos,Beatriz Loção Facial Dermatus - Tônico Facial - 120ml,https://www.epocacosmeticos.com.br/beatriz-locao-facial-dermatus-tonico-facial/p
Anthelios AE Fps 50 La Roche Posay - Época Cosméticos,Anthelios Ae Gel-Creme Velouté Fps 50 La Roche Posay - Protetor Solar Facial - 50g,https://www.epocacosmeticos.com.br/anthelios-ae-gel-creme-veloute-fps-50-la-roche-posay-protetor-solar-facial/p
Sérum 10 SkinCeuticals - Rejuvenescedor Facial - Época Cosméticos,Serum 10 SkinCeuticals - Rejuvenescedor Facial - 30ml,https://www.epocacosmeticos.com.br/serum-10-skinceuticals-rejuvenescedor-facial/p
Redermic R La Roche Posay - Rejuvenescedor Facial - Época Cosméticos,Redermic R La Roche Posay - Rejuvenescedor Facial - 30g,https://www.epocacosmeticos.com.br/redermic-r-la-roche-posay-rejuvenescedor-facial/p
Redermic Hyalu C Olhos La Roche Posay - Época Cosméticos,Redermic Hyalu C Olhos La Roche Posay - Rejuvenescedor para o Contorno dos Olhos - 15ml,https://www.epocacosmeticos.com.br/redermic-hyalu-c-olhos-la-roche-rejuvenescedor-para-o-contorno-dos-olhos/p
Redermic Hyalu C La Roche Posay - Rejuvenescedor Facial - Época Cosméticos,Redermic Hyalu C La Roche Posay - Rejuvenescedor Facial - 40ml,https://www.epocacosmeticos.com.br/redermic-hyalu-c-la-roche-posay-rejuvenescedor-facial/p
Rejuvenescedor Facial Skinceuticals - CE Ferulic - Época Cosméticos,Rejuvenescedor Facial Skinceuticals - CE Ferulic - 15ml,https://www.epocacosmeticos.com.br/rejuvenescedor-facial-skinceuticals-ce-ferulic/p
Protetor Facial Vichy - Idéal Soleil Antiidade FPS 50 - Época Cosméticos,Protetor Solar Facial Vichy - Idéal Soleil Antiidade Toque Seco FPS 50 - 40g,https://www.epocacosmeticos.com.br/protetor-solar-facial-vichy-ideal-soleil-antiidade-toque-seco-fps-50/p
Protetor Solar Facial Vichy - Idéal Soleil Toque Seco FPS 50 - Época Cosméticos,Protetor Solar Facial Vichy - Idéal  Soleil Toque Seco FPS 50 - 40g,https://www.epocacosmeticos.com.br/protetor-solar-facial-vichy-ideal-capital-soleil-toque-seco-fps-50/p
Sabonete Facial La Roche-Posay - Effaclar Concentrado - Época Cosméticos,Limpador Facial La Roche-Posay - Effaclar Sabonete Concentrado - 70g,https://www.epocacosmeticos.com.br/limpador-facial-la-roche-posay-effaclar-sabonete-concentrado/p
Protetor Solar Skinceuticals Physical Matte UV Defense - Época Cosméticos,Protetor Solar Skinceuticals - Physical Matte UV Defense SPF50 - 30ml,https://www.epocacosmeticos.com.br/protetor-solar-skinceuticals-physical-matte-uv-defense-spf50/p
Solução Micelar La Roche-Posay - Effaclar Eau Micellaire Ultra - Época Cosméticos,Solução Micelar La Roche-Posay - Effaclar Eau Micellaire Ultra - 100ml,https://www.epocacosmeticos.com.br/solucao-micelar-la-roche-posay-effaclar-eau-micellaire-ultra/p
Solução Micelar La Roche-Posay - Effaclar Eau Micellaire Ultra - Época Cosméticos,Solução Micelar La Roche-Posay - Effaclar Eau Micellaire Ultra - 200ml,https://www.epocacosmeticos.com.br/solucao-micelar-la-roche-posay-effaclar-eau-micellaire-ultra/p
Protetor Solar - La Roche Posay Anthelios XL Protect FPS60 - Época Cosméticos,Protetor Solar - La Roche Posay Anthelios XL Protect FPS60 - 40g,https://www.epocacosmeticos.com.br/protetor-solar-la-roche-posay-anthelios-xl-protect-fps60/p
Bepantol Derma Solução Bayer - Hidratante Líquido - Época Cosméticos,Bepantol Derma Solução Bayer - Hidratante Líquido - 50ml,https://www.epocacosmeticos.com.br/bepantol-derma-solucao-bayer-hidratante-liquido/p
Ideal Body Loção Serum Vichy - Hidratante Corporal - Época Cosméticos,Ideal Body Loção Serum Vichy - Hidratante Corporal - 200g,https://www.epocacosmeticos.com.br/ideal-body-locao-serum-vichy-hidratante-corporal/p
Normaderm 3 em 1 Vichy - Limpeza Facial - Época Cosméticos - Época Cosméticos,Normaderm 3 em 1 Vichy - Limpeza Facial - 125ml,https://www.epocacosmeticos.com.br/normaderm-3-em-1-vichy-limpeza-facial/p
Normaderm Skin Balance Vichy - Tratamento Facial - Época Cosméticos - Época Cosméticos,Normaderm Skin Balance Vichy - Tratamento Facial - 40g,https://www.epocacosmeticos.com.br/normaderm-skin-balance-vichy-tratamento-facial/p
Redermic R La Roche Posay - Rejuvenescedor Facial - Época Cosméticos,Redermic R Corrective UV FPS30 La Roche Posay - Rejuvenescedor Facial - 40ml,https://www.epocacosmeticos.com.br/redermic-r-corrective-uv-fps30-la-roche-posay-rejuvenescedor-facial/p
Anthelios XL FPS 70 La Roche Posay - Protetor Solar - Época Cosméticos,Anthelios XL FPS 70 La Roche Posay - Protetor Solar - 120ml,https://www.epocacosmeticos.com.br/anthelios-xl-fps-70-la-roche-posay-protetor-solar/p
Anthelios XL FPS 70 La Roche Posay - Protetor Solar - Época Cosméticos,Anthelios XL FPS 70 La Roche Posay - Protetor Solar - 200ml,https://www.epocacosmeticos.com.br/anthelios-xl-fps-70-la-roche-posay-protetor-solar/p
Sébium Pore Refiner Bioderma - Sérum Reduto de Poros - Época Cosméticos,Sébium Pore Refiner Bioderma - Sérum Reduto de Poros - 30ml,https://www.epocacosmeticos.com.br/sebium-pore-refiner-bioderma-creme-redutor/p
Sébium Gel Moussant Bioderma - Gel de Limpeza - Época Cosméticos - Época Cosméticos,Sébium Gel Moussant Bioderma - Gel de Limpeza - 45ml,https://www.epocacosmeticos.com.br/sebium-gel-moussant-bioderma-gel-de-limpeza/p
Sébium Gel Moussant Bioderma - Gel de Limpeza - Época Cosméticos - Época Cosméticos,Sébium Gel Moussant Bioderma - Gel de Limpeza - 100ml,https://www.epocacosmeticos.com.br/sebium-gel-moussant-bioderma-gel-de-limpeza/p
Gel de Silicone Kelo-Cote - Gel Redutor de Cicatrizes - Época Cosméticos - Época Cosméticos,Gel de Silicone Kelo-Cote - Gel Redutor de Cicatrizes - 15g,https://www.epocacosmeticos.com.br/gel-de-silicone-kelo-cote-gel-redutor-de-cicatrizes/p
Pro-Renove Anti-Ageing Unifying Cream Roc - Tratamento Anti-Idade - Época Cosméticos,Pro-Renove Anti-Ageing Unifying Cream Roc - Tratamento Anti-Idade - 50ml,https://www.epocacosmeticos.com.br/pro-renove-anti-ageing-unifying-cream-roc-tratamento-anti-idade/p
Protetor Solar Facial Pink Cheeks Pink Stick FPS 90 - Época Cosméticos,Protetor Solar Facial Pink Cheeks Pink Stick FPS 90 - 5km,https://www.epocacosmeticos.com.br/pink-stick-fps-60-pink-cheeks-protetor-solar-facial/p
Protetor Solar Facial Pink Cheeks Pink Stick FPS 90 - Época Cosméticos,Protetor Solar Facial Pink Cheeks Pink Stick FPS 90 - 10km,https://www.epocacosmeticos.com.br/pink-stick-fps-60-pink-cheeks-protetor-solar-facial/p
Protetor Solar Facial Pink Cheeks Pink Stick FPS 90 - Época Cosméticos,Protetor Solar Facial Pink Cheeks Pink Stick FPS 90 - 15km,https://www.epocacosmeticos.com.br/pink-stick-fps-60-pink-cheeks-protetor-solar-facial/p
Protetor Solar Facial Pink Cheeks Pink Stick FPS 90 - Época Cosméticos,Protetor Solar Facial Pink Cheeks Pink Stick FPS 90 - 21km,https://www.epocacosmeticos.com.br/pink-stick-fps-60-pink-cheeks-protetor-solar-facial/p
Protetor Solar Facial Pink Cheeks Pink Stick FPS 90 - Época Cosméticos,Protetor Solar Facial Pink Cheeks Pink Stick FPS 90 - 42km,https://www.epocacosmeticos.com.br/pink-stick-fps-60-pink-cheeks-protetor-solar-facial/p
Protetor Solar Facial Pink Cheeks Pink Stick FPS 90 - Época Cosméticos,Protetor Solar Facial Pink Cheeks Pink Stick FPS 90 - 42km Rio,https://www.epocacosmeticos.com.br/pink-stick-fps-60-pink-cheeks-protetor-solar-facial/p
Base Líquida Dermablend - Vichy - Base para Rosto FPS 35 - Época Cosméticos,Base Líquida Dermablend - Vichy - Base para Rosto FPS 35 - 15 - Opal,https://www.epocacosmeticos.com.br/dermablend-base-liquida-fps-35-vichy-base-para-rosto/p
Base Líquida Dermablend - Vichy - Base para Rosto FPS 35 - Época Cosméticos,Base Líquida Dermablend - Vichy - Base para Rosto FPS 35 - 25 - Nude,https://www.epocacosmeticos.com.br/dermablend-base-liquida-fps-35-vichy-base-para-rosto/p
Base Líquida Dermablend - Vichy - Base para Rosto FPS 35 - Época Cosméticos,Base Líquida Dermablend - Vichy - Base para Rosto FPS 35 - 35 - Sand,https://www.epocacosmeticos.com.br/dermablend-base-liquida-fps-35-vichy-base-para-rosto/p
Base Líquida Dermablend - Vichy - Base para Rosto FPS 35 - Época Cosméticos,Base Líquida Dermablend - Vichy - Base para Rosto FPS 35 - 55 - Bronze,https://www.epocacosmeticos.com.br/dermablend-base-liquida-fps-35-vichy-base-para-rosto/p
Base Líquida Dermablend - Vichy - Base para Rosto FPS 35 - Época Cosméticos,Base Líquida Dermablend - Vichy - Base para Rosto FPS 35 - 45 - Gold,https://www.epocacosmeticos.com.br/dermablend-base-liquida-fps-35-vichy-base-para-rosto/p
Neovadiol Concentrado Vichy - Rejuvenescedor - Época Cosméticos,Neovadiol Concentrado Vichy - Rejuvenescedor Facial - 30ml,https://www.epocacosmeticos.com.br/neovadiol-concentrado-vichy-rejuvenescedor-facial/p
Age Eye Complex SkinCeuticals - Época Cosméticos,Age Eye Complex SkinCeuticals - Rejuvenescedor para o Contorno dos Olhos - 15ml,https://www.epocacosmeticos.com.br/age-eye-complex-skinceuticals-rejuvenescedor-para-o-contorno-dos-olhos/p
Redermic R Eyes La Roche Posay - Época Cosméticos,Redermic R Eyes La Roche Posay - Rejuvenescedor para o Contorno dos Olhos - 15ml,https://www.epocacosmeticos.com.br/redermic-r-eyes-la-roche-posay-rejuvenescedor-para-o-contorno-dos-olhos/p
LHA Cleansing Gel Skinceuticals - Época Cosméticos,LHA Cleansing Gel Skinceuticals - Gel de Limpeza Facial - 80g,https://www.epocacosmeticos.com.br/lha-cleasing-gel-skinceuticals-gel-de-limpeza-facial/p
Protetor Solar Facial Capital Soleil Toque Seco com Cor FPS50 Vichy - Época Cosméticos,Capital Soleil Toque Seco com Cor FPS 50 Vichy - Protetor Solar Facial - Universal,https://www.epocacosmeticos.com.br/capital-soleil-toque-seco-com-cor-fps-50-vichy-protetor-solar/p
Effaclar Mat La Roche Posay - Hidratante Facial - Época Cosméticos,Effaclar Mat La Roche Posay - Hidratante Facial - 40ml,https://www.epocacosmeticos.com.br/effaclar-mat-la-roche-posay-hidratante-facial/p
Effaclar Gel Concentrado Desincrustante La Roche Posay - Limpador Facial - Época Cosméticos,Effaclar Gel Concentrado Desincrustante La Roche Posay - Limpador Facial - 60g,https://www.epocacosmeticos.com.br/effaclar-gel-concentrado-desincrustante-la-roche-posay-limpador-facial/p
Cicaplast Baume B5 La Roche Posay - Hidratante Reparador - Época Cosméticos,Cicaplast Baume B5 La Roche Posay - Hidratante Reparador - 20ml,https://www.epocacosmeticos.com.br/cicaplast-baume-b5-la-roche-posay-hidratante-reparador/p
Cicaplast Baume B5 La Roche Posay - Hidratante Reparador - Época Cosméticos,Cicaplast Baume B5 La Roche Posay - Hidratante Reparador - 40ml,https://www.epocacosmeticos.com.br/cicaplast-baume-b5-la-roche-posay-hidratante-reparador/p
Phloretin CF SkinCeuticals - Rejuvenescedor Facial - Época Cosméticos,SkinCeuticals Phloretin CF SkinCeuticals - Rejuvenescedor Facial - 30ml,https://www.epocacosmeticos.com.br/skin-ceuticals-phloretin-cf-skinceuticals-rejuvenescedor-facial/p
Redermic Hyalu C UV FPS 25 La Roche Posay - Época Cosméticos,Redermic Hyalu C Uv FPS 25 La Roche Posay - Rejuvenescedor Facial - 15ml,https://www.epocacosmeticos.com.br/redermic-hyalu-c-uv-fps25-la-roche-posay-rejuvenescedor-facial/p
Redermic Hyalu C UV FPS 25 La Roche Posay - Época Cosméticos,Redermic Hyalu C Uv FPS 25 La Roche Posay - Rejuvenescedor Facial - 40ml,https://www.epocacosmeticos.com.br/redermic-hyalu-c-uv-fps25-la-roche-posay-rejuvenescedor-facial/p
Physical Fusion SPF 50 Skinceuticals - Época Cosméticos,Physical Fusion Color Uv Defense SPF 50 Skinceuticals - Protetor Solar - 50ml,https://www.epocacosmeticos.com.br/physical-fusion-uv-defense-spf-50-skinceuticals-protetor-solar/p
Normalize Pore Fps 50 Ada Tina - Protetor Solar - Época Cosméticos,Normalize Pore Fps 50 Ada Tina - Protetor Solar - 50ml,https://www.epocacosmeticos.com.br/normalize-pore-fps-50-ada-tina-protetor-solar-facial/p
Normalize Ft Fps 30 Ada Tina - Protetor Solar - Época Cosméticos,Normalize Ft Fps 30 Ada Tina - Protetor Solar - Beige,https://www.epocacosmeticos.com.br/normalize-ft-fps-30-ada-tina-protetor-solar-facial-com-cor/p
Normalize Ft Fps 30 Ada Tina - Protetor Solar - Época Cosméticos,Normalize Ft Fps 30 Ada Tina - Protetor Solar - Bronze,https://www.epocacosmeticos.com.br/normalize-ft-fps-30-ada-tina-protetor-solar-facial-com-cor/p
Normalize Ft Fps 30 Ada Tina - Protetor Solar - Época Cosméticos,Normalize Ft Fps 30 Ada Tina - Protetor Solar - Luce,https://www.epocacosmeticos.com.br/normalize-ft-fps-30-ada-tina-protetor-solar-facial-com-cor/p
Normalize Ft Fps 30 Ada Tina - Protetor Solar - Época Cosméticos,Normalize Ft Fps 30 Ada Tina - Protetor Solar - Pelle,https://www.epocacosmeticos.com.br/normalize-ft-fps-30-ada-tina-protetor-solar-facial-com-cor/p
Normalize Fps 60 Ada Tina - Protetor Solar - Época Cosméticos,Normalize Fps 60 Ada Tina - Protetor Solar - 50ml,https://www.epocacosmeticos.com.br/normalize-fps-60-ada-tina-protetor-solar/p
Heliocare Max Defense Gel FPS 90 Heliocare - Protetor Solar - Época Cosméticos,Heliocare Max Defense Gel FPS 90 Heliocare - Protetor Solar - 50g,https://www.epocacosmeticos.com.br/heliocare-max-defense-gel-fps90-heliocare-protetor-solar/p
Máscara Facial Hidratante Dermage Caviar Gold Mask - Época Cosméticos,Máscara Facial Hidratante Dermage Caviar Gold Mask - 10g,https://www.epocacosmeticos.com.br/mascara-facial-hidratante-dermage-caviar-gold-mask-10g/p
Máscara Facial Anti-idade Dermage - Collagen Mask - Época Cosméticos,Máscara Facial Anti-idade Dermage - Collagen Mask - 10g,https://www.epocacosmeticos.com.br/mascara-facial-anti-idade-dermage-collagen-mask-10g/p
Máscara Facial Revigorante Dermage - Detox Mask - Época Cosméticos,Máscara Facial Revigorante Dermage - Detox Mask - 10g,https://www.epocacosmeticos.com.br/mascara-facial-revigorante-dermage-detox-mask-10g/p
Protetor Solar Ada Tina - Normalize Matte Intense FPS 50 - Época Cosméticos,Protetor Solar Ada Tina - Normalize Matte Intense FPS 50 - 40ml,https://www.epocacosmeticos.com.br/protetor-solar-ada-tina-normalize-matte-intense-fps-50/p
Protetor Solar Avène - Emulsão Solar FPS 70 Color - Época Cosméticos,Protetor Solar Avène - Emulsão Solar Toque Seco FPS 70 Color - Universal,https://www.epocacosmeticos.com.br/protetor-solar-avene-emulsao-solar-fps-70-color/p
Idéal Capital Soleil Clarify Vichy- Protetor Solar - Época Cosméticos,Idéal Capital Soleil Clarify Vichy- Protetor Solar - 40g,https://www.epocacosmeticos.com.br/ideal-capital-soleil-clarify-vichy-protetor-solar/p
Protetor Solar Facial Vichy - Idéal Soleil Toque Seco FPS30 - Época Cosméticos,Protetor Solar Facial Vichy - Idéal Soleil Toque Seco FPS30 - 40g,https://www.epocacosmeticos.com.br/protetor-solar-facial-vichy-ideal-soleil-toque-seco-fps30/p
Anti-Imperfeições La Roche-Posay - Effaclar Duo (+) FPS30 - Época Cosméticos,Anti-Imperfeições La Roche-Posay - Effaclar Duo (+) FPS30 - 40ml,https://www.epocacosmeticos.com.br/anti-imperfeicoes-la-roche-posay-effaclar-duo-fps30/p
Protetor Solar Roc - Minesol Oil Control Sérum Antioxidante FPS30 - Época Cosméticos,Protetor Solar Roc - Minesol Oil Control Sérum Antioxidante FPS30 - 50g,https://www.epocacosmeticos.com.br/protetor-solar-roc-minesol-oil-control-serum-antioxidante-fps30/p
Rejuvenescedor Facial Vichy -  Idealia Sérum Reenergizador - Época Cosméticos,Rejuvenescedor Facial Vichy -  Idealia Sérum Reenergizador - 30ml,https://www.epocacosmeticos.com.br/rejuvenescedor-facial-vichy-idealia-serum-reenergizador/p
Protetor Solar Facial Bioderma - Photoderm Nude Touch FPS50+ - Época Cosméticos,Protetor Solar Facial Bioderma - Photoderm Nude Touch FPS50+ - Claro,https://www.epocacosmeticos.com.br/protetor-solar-facial-bioderma-photoderm-nude-touch-fps50/p
Protetor Solar Facial Bioderma - Photoderm Nude Touch FPS50+ - Época Cosméticos,Protetor Solar Facial Bioderma - Photoderm Nude Touch FPS50+ - Muito Claro,https://www.epocacosmeticos.com.br/protetor-solar-facial-bioderma-photoderm-nude-touch-fps50/p
Protetor Solar Facial Bioderma - Photoderm Nude Touch FPS50+ - Época Cosméticos,Protetor Solar Facial Bioderma - Photoderm Nude Touch FPS50+ - Dourado,https://www.epocacosmeticos.com.br/protetor-solar-facial-bioderma-photoderm-nude-touch-fps50/p
Hidratante Corporal La Roche Posay - Lipikar Aox Fps61 - Época Cosméticos,Hidratante Corporal La Roche Posay - Lipikar Aox Fps60 - 200ml,https://www.epocacosmeticos.com.br/hidratante-corporal-la-roche-posay-lipikar-aox-fps60/p
