title,product name,url
Máscara Facial Dermatus Resistência e Viço - Época Cosméticos,Máscara Facial Dermatus Resistência e Viço - 100g,https://www.epocacosmeticos.com.br/mascara-facial-dermatus-resistencia-e-vico/p
Máscara Facial Dermatus Renovação - Época Cosméticos,Máscara Facial Dermatus Renovação - 120g,https://www.epocacosmeticos.com.br/mascara-facial-dermatus-renovacao/p
Máscara Facial Dermatus Mask Plus - Época Cosméticos,Máscara Facial Dermatus Mask Plus - 100g,https://www.epocacosmeticos.com.br/mascara-facial-dermatus-mask-plus/p
Máscara Facial Dermatus Mask B. - Época Cosméticos,Máscara Facial Dermatus Mask B. - 100g,https://www.epocacosmeticos.com.br/mascara-facial-dermatus-mask-b/p
Máscara Facial Dermatus Hidratação e Conforto - Época Cosméticos,Máscara Facial Dermatus Hidratação e Conforto - 120g,https://www.epocacosmeticos.com.br/mascara-facial-dermatus-hidratacao-e-conforto/p
Máscara Facial Dermatus Reposição e Equilíbrio - Época Cosméticos,Máscara Facial Dermatus Reposição e Equilíbrio - 120g,https://www.epocacosmeticos.com.br/mascara-facial-dermatus-reposicao-e-equilibrio/p
Máscara Clareadora Dermatus Clareamento e Luminosidade - Época Cosméticos,Máscara Clareadora Dermatus Clareamento e Luminosidade - 120g,https://www.epocacosmeticos.com.br/mascara-clareadora-dermatus-clareamento-e-luminosidade/p
Máscara Facial Dermatus Brilho Energia Infusão de Oxigênio - Época Cosméticos,Máscara Facial Dermatus Brilho Energia Infusão de Oxigênio - 120g,https://www.epocacosmeticos.com.br/mascara-facial-dermatus-brilho-energia-infusao-de-oxigenio/p
Shampoo Ada Tina Amplexe Anticaspa Couro Sensível - Época Cosméticos,Shampoo Ada Tina Amplexe Anticaspa Couro Sensível - 200ml,https://www.epocacosmeticos.com.br/shampoo-ada-tina-amplexe-anticaspa-couro-sensivel/p
Redutor de Medidas Ada Tina Claffeise AB - Época Cosméticos,Redutor de Medidas Ada Tina Claffeise AB - 200ml,https://www.epocacosmeticos.com.br/redutor-de-medidas-ada-tina-claffeise-ab/p
Calcanheira For Her Dr. Scholls - Protetor para Calcanhar - Época Cosméticos,Calcanheira For Her Dr. Scholls - Protetor para Calcanhar - 1 Par,https://www.epocacosmeticos.com.br/calcanheira-for-her-dr-scholl-s-protetor-para-calcanhar/p
Coppertone Toque Seco Spray FPS 30 Bayer - Protetor Solar - Época Cosméticos,Coppertone Toque Seco Spray FPS 30 Bayer - Protetor Solar - 177ml,https://www.epocacosmeticos.com.br/coppertone-toque-seco-spray-fps-30-bayer-protetor-solar/p
M-Drow Intlab - Suplemento - Época Cosméticos,M-Drow Intlab - Suplemento - 30 Capsúlas,https://www.epocacosmeticos.com.br/m-drow-intlab-suplemento/p
Lipo 100 Black Intlab - Suplemento de Cafeína - Época Cosméticos,Lipo 100 Black Intlab - Suplemento de Cafeína - 60 cápsulas,https://www.epocacosmeticos.com.br/lipo-100-black-intlab-suplemento-de-cafeina/p
DermatoCLEAN Solução Micelar 3 em 1 Eucerin - Limpeza Facial - Época Cosméticos,DermatoCLEAN Solução Micelar 3 em 1 Eucerin - Limpeza Facial - 200ml,https://www.epocacosmeticos.com.br/dermatoclean-solucao-micelar-3-em-1-eucerin-limpeza-facial/p
Episol Fps45 Loção Oil Free Episol - Protetor Solar - Época Cosméticos - Época Cosméticos,Episol Fps45 Loção Oil Free Episol - Protetor Solar - 120ml,https://www.epocacosmeticos.com.br/episol-fps45-locao-oil-free-episol-protetor-solar/p
Hydrance Optimale Fps30 Perfector Avène - Hidratante Facial - Época Cosméticos - Época Cosméticos,Hydrance Optimale Fps30 Perfector Avène - Hidratante Facial - 40ml,https://www.epocacosmeticos.com.br/hydrance-optimale-fps30-perfector-avene-hidratante-facial/p
Claffeise Áreas Críticas Ada Tina - Redutor de Anticelulite - Época Cosméticos - Época Cosméticos,Claffeise Áreas Críticas Ada Tina - Redutor de Anticelulite - 200ml,https://www.epocacosmeticos.com.br/claffeise-areas-criticas-ada-tina-redutor-de-anticelulite/p
Creastim Ducray - Loção antiqueda - Época Cosméticos - Época Cosméticos,Creastim Ducray - Loção antiqueda - 2x 30ml,https://www.epocacosmeticos.com.br/creastim-ducray-locao-antiqueda/p
Uomo Antiqueda Ada Tina - Shampoo - Época Cosméticos,Uomo Antiqueda Ada Tina - Shampoo - 100ml,https://www.epocacosmeticos.com.br/uomo-antiqueda-ada-tina-shampoo/p
Uomo Antiqueda Ada Tina - Loção Capilar - Época Cosméticos,Uomo Antiqueda Ada Tina - Loção Capilar - 50ml,https://www.epocacosmeticos.com.br/uomo-antiqueda-ada-tina-locao-capilar/p
Uomo Exfo Soap Ada Tina - Esfoliante - Época Cosméticos,Uomo Exfo Soap Ada Tina - Esfoliante - 50g,https://www.epocacosmeticos.com.br/uomo-exfo-soap-ada-tina-esfoliante/p
Uomo Cleanser Gel Ada Tina - Gel de Limpeza - Época Cosméticos,Uomo Cleanser Gel Ada Tina - Gel de Limpeza - 100g,https://www.epocacosmeticos.com.br/uomo-cleanser-gel-ada-tina-gel-de-limpeza/p
Uomo Antiaging Oxy Ada Tina - Rejuvenescedor Facial - Época Cosméticos,Uomo Antiaging Oxy Ada Tina - Rejuvenescedor Facial - 30ml,https://www.epocacosmeticos.com.br/uomo-antiaging-oxy-ada-tina-rejuvenescedor-facial/p
Nutribalm 20+ Ada Tina - Hidratante Corporal - Época Cosméticos - Época Cosméticos,Nutribalm 20+ Ada Tina - Hidratante Corporal - 200ml,https://www.epocacosmeticos.com.br/nutribalm-20-ada-tina-hidratante-corporal/p
Kit Caneta Clareadora da Mão e Rosto + Caneta Clareada da Pele Spotner - Época Cosméticos,Kit Caneta Clareadora da Mão e Rosto + Caneta Clareada da Pele Spotner,https://www.epocacosmeticos.com.br/kit-spotner-caneta-clareadora-da-mao-e-rosto-caneta-clareada-da-pele/p
Caneta Clareadora da Pele Spotner Face Rosto e Colo - Época Cosméticos,Caneta Clareadora da Pele Spotner Face Rosto e Colo - 2ml,https://www.epocacosmeticos.com.br/face-rosto-e-colo-spotner-caneta-clareadora-da-pele/p
Caneta Clareadora Spotner Hard Mãos e Corpo - Época Cosméticos,Caneta Clareadora Spotner Hard Mãos e Corpo - 2ml,https://www.epocacosmeticos.com.br/hard-maos-e-corpo-spotner-caneta-clareadora/p
Oil Control Lotion Dermalogica - Loção Facial - Época Cosméticos - Época Cosméticos,Oil Control Lotion Dermalogica - Loção Facial - 59ml,https://www.epocacosmeticos.com.br/oil-control-lotion-dermalogica-locao-facial/p
Gentle Soothing Booster Dermalogica - Tratamento Facial - Época Cosméticos - Época Cosméticos,Gentle Soothing Booster Dermalogica - Tratamento Facial - 30ml,https://www.epocacosmeticos.com.br/gentle-soothing-booster-dermalogica-tratamento-facial/p
Skin Hydrating Booster Dermalogica - Tratamento Facial - Época Cosméticos - Época Cosméticos,Skin Hydrating Booster Dermalogica - Tratamento Facial - 30ml,https://www.epocacosmeticos.com.br/skin-hydrating-booster-dermalogica-tratamento-facial/p
Daily Microfoliant Dermalogica - Esfoiliante Facial - Época Cosméticos - Época Cosméticos,Daily Microfoliant Dermalogica - Esfoiliante Facial - 74g,https://www.epocacosmeticos.com.br/daily-microfoliant-dermalogica-esfoiliante-facial/p
pH5 Skin Protection Eucerin - Loção Corporal - Época Cosméticos - Época Cosméticos,pH5 Skin Protection Eucerin - Loção Corporal - 400ml,https://www.epocacosmeticos.com.br/ph5-skin-protection-eucerin-locao-corporal/p
In Shower Loção Corporal Eucerin - Hidratante para Banho - Época Cosméticos - Época Cosméticos,In Shower Loção Corporal Eucerin - Hidratante para Banho - 400ml,https://www.epocacosmeticos.com.br/in-shower-locao-corporal-eucerin-hidratante-para-banho/p
LA Miracle Midway - Suplemento de Vitaminas E - Época Cosméticos - Época Cosméticos,LA Miracle Midway - Suplemento de Vitaminas E - 120 Cápsulas,https://www.epocacosmeticos.com.br/la-miracle-midway-suplemento-de-vitaminas-e/p
Ripped USA Midway - Suplemento de Cafeína - Época Cosméticos - Época Cosméticos,Ripped USA Midway - Suplemento de Cafeína - 120 Cápsulas,https://www.epocacosmeticos.com.br/ripped-usa-midway-suplemento-de-cafeina/p
Joint Way USA Midway - Suplemento de Vitaminas e Minerais - Época Cosméticos - Época Cosméticos,Joint Way USA Midway - Suplemento de Vitaminas e Minerais - 90 Cápsulas,https://www.epocacosmeticos.com.br/joint-way-usa-midway-suplemento-de-vitaminas-e-minerais/p
Creatine USA Powder Midway - Suplemento de Creatina - Época Cosméticos - Época Cosméticos,Creatine USA Powder Midway - Suplemento de Creatina - 100g,https://www.epocacosmeticos.com.br/creatine-usa-powder-midway-suplemento-de-creatina/p
Hydroxy 6 Midway - Suplemento de Cafeína - Época Cosméticos - Época Cosméticos,Hydroxy 6 Midway - Suplemento de Cafeína - 90 Cápsulas,https://www.epocacosmeticos.com.br/hydroxy-6-midway-suplemento-de-cafeina/p
Hardest BCAA Midway - Suplemento de Aminoácidos - Época Cosméticos - Época Cosméticos,Hardest BCAA Midway - Suplemento de Aminoácidos - 120 Cápsulas,https://www.epocacosmeticos.com.br/hardest-bcaa-midway-suplemento-de-aminoacidos/p
L-Carnitine Liquid Midway - Emagrecedor - Época Cosméticos - Época Cosméticos,L-Carnitine Liquid Midway - Emagrecedor - 473ml,https://www.epocacosmeticos.com.br/l-carnitine-liquid-midway-emagrecedor/p
Creatine USA Midway - Suplemento de Creatina - Época Cosméticos - Época Cosméticos,Creatine USA Tabs Midway - Suplemento de Creatina - 120 Cápsulas,https://www.epocacosmeticos.com.br/creatine-usa-midway-suplemento-de-creatina/p
Caffeine USA Midway - Suplemento de Cafeína - Época Cosméticos - Época Cosméticos,Caffeine USA Midway - Suplemento de Cafeína - 90 Cápsulas,https://www.epocacosmeticos.com.br/caffeine-usa-midway-suplemento-de-cafeina/p
Caffeine Anhydrous Midway - Suplemento de Cafeína - Época Cosméticos - Época Cosméticos,Caffeine Anhydrous Midway - Suplemento de Cafeína - 90 Cápsulas,https://www.epocacosmeticos.com.br/caffeine-anhydrous-midway-suplemento-de-cafeina/p
B Complex Midway - Suplemento à Base de Vitaminas - Época Cosméticos - Época Cosméticos,B Complex Midway - Suplemento à Base de Vitaminas - 90 Cápsulas,https://www.epocacosmeticos.com.br/b-complex-midway-suplemento-a-base-de-vitaminas/p
Protetor Solar Natupele Soless FPS 45 Aerosol - Época Cosméticos,Protetor Solar Natupele Soless FPS 45 Aerosol - 120g,https://www.epocacosmeticos.com.br/soless-fps-45-aerosol-uva-uvb-natupele-protetor-solar/p
Termolen Cellfirm Equaliv - Suplemento Vitaminico - Época Cosméticos - Época Cosméticos,Termolen Cellfirm Equaliv - Suplemento Vitaminico - 31 Cápsulas,https://www.epocacosmeticos.com.br/termolen-cellfirm-equaliv-suplemento-vitaminico/p
Nutri Silver Equaliv - Multivitamínico - Época Cosméticos,Nutri Silver Equaliv - Multivitamínico - 60 Cápsulas,https://www.epocacosmeticos.com.br/nutri-silver-equaliv-multivitaminico/p
Powerfit Volt Caffeine Nutrilatina - Suplemento de Cafeína - Época Cosméticos - Época Cosméticos,Powerfit Volt Caffeine Nutrilatina - Suplemento de Cafeína - 90 Cápsulas,https://www.epocacosmeticos.com.br/powerfit-volt-caffeine-nutrilatina-suplemento-de-cafeina/p
Powerfit Ômega 3 Nutrilatina - Época Cosméticos - Época Cosméticos,Powerfit Ômega 3 Nutrilatina - Redutor de Triglicerídeos - 50 Cápsulas,https://www.epocacosmeticos.com.br/powerfit-omega-3-nutrilatina-redutor-de-triglicerideo/p
Protetor Solar Facial Fps 30 Episol Water Gel - Protetor Solar - Época Cosméticos - Época Cosméticos,Protetor Solar Facial Fps 30 Episol Water Gel - Protetor Solar - 60g,https://www.epocacosmeticos.com.br/protetor-solar-facial-fps-30-episol-water-gel-protetor-solar/p
Loção Fps 30 Episol Fluido - Protetor Solar - Época Cosméticos - Época Cosméticos,Loção Fps 30 Episol Fluido - Protetor Solar - 60g,https://www.epocacosmeticos.com.br/locao-fps-30-episol-fluido-protetor-solar/p
Complete Repair Loção Intensiva Eucerin - Loção Corporal - Época Cosméticos - Época Cosméticos,Complete Repair Loção Intensiva Eucerin - Loção Corporal - 250ml,https://www.epocacosmeticos.com.br/complete-repair-locao-intensiva-eucerin-locao-corporal/p
DermoPURIFYER Gel de Limpeza Eucerin - Gel de Limpeza - Época Cosméticos - Época Cosméticos,DermoPURIFYER Gel de Limpeza Eucerin - Gel de Limpeza - 200ml,https://www.epocacosmeticos.com.br/dermopurifyer-gel-de-limpeza-eucerin-gel-de-limpeza/p
pH5 Loção Eucerin - Loção Corporal - Época Cosméticos - Época Cosméticos,pH5 Loção Eucerin - Loção Corporal - 125ml,https://www.epocacosmeticos.com.br/ph5-locao-eucerin-locao-corporal/p
pH5 Syndet Eucerin - Gel de Limpeza - Época Cosméticos - Época Cosméticos,"pH5 Syndet Eucerin - Gel de Limpeza - 260,4g",https://www.epocacosmeticos.com.br/ph5-syndet-eucerin-gel-de-limpeza/p
All body Dermatus - Redutor de Medidas - Época Cosméticos,All body Dermatus - Redutor de Medidas - 150g,https://www.epocacosmeticos.com.br/all-body-dermatus-redutor-de-medidas/p
Fort In Hair Biomarine - Condicionador Energizante - Época Cosméticos - Época Cosméticos,Fort In Hair Biomarine - Condicionador Energizante - 200ml,https://www.epocacosmeticos.com.br/fort-in-hair-biomarine-condicionador-energizante/p
Rever-C CC Eyes Pigment Universal Biomarine - Corretivo para Olhos - Época Cosméticos - Época Cosméticos,Rever-C CC Eyes Pigment Universal Biomarine - Corretivo para Olhos - 15g,https://www.epocacosmeticos.com.br/rever-c-cc-eyes-pigment-universal-biomarine-corretivo-para-olhos/p
DD Blur Cream Fps58 Biomarine - Tratamento Antimanchas - Época Cosméticos - Época Cosméticos,DD Blur Cream Fps58 Biomarine - Tratamento Antimanchas 60g - Natural,https://www.epocacosmeticos.com.br/dd-blur-cream-fps58-biomarine-tratamento-antimanchas/p
DD Blur Cream Fps58 Biomarine - Tratamento Antimanchas - Época Cosméticos - Época Cosméticos,DD Blur Cream Fps58 Biomarine - Tratamento Antimanchas 60g - Bege,https://www.epocacosmeticos.com.br/dd-blur-cream-fps58-biomarine-tratamento-antimanchas/p
DD Blur Cream Fps58 Biomarine - Tratamento Antimanchas - Época Cosméticos - Época Cosméticos,DD Blur Cream Fps58 Biomarine - Tratamento Antimanchas 60g - Bronze,https://www.epocacosmeticos.com.br/dd-blur-cream-fps58-biomarine-tratamento-antimanchas/p
Minesol Actif Unify Tinted Mousse Medium Fps30 Roc - Protetor Solar - Época Cosméticos - Época Cosméticos,Minesol Actif Unify Tinted Mousse Medium Fps30 Roc - Protetor Solar - 40g,https://www.epocacosmeticos.com.br/minesol-actif-unify-tinted-mousse-medium-fps30-roc-protetor-solar/p
Gliventi Pure Ada Tina - Hidratante Antirressecamento - Época Cosméticos - Época Cosméticos,Gliventi Pure Ada Tina - Hidratante Antirressecamento - 200ml,https://www.epocacosmeticos.com.br/gliventi-pure-ada-tina-hidratante-antirressecamento/p
Skin Plus Base Corretiva Aderente FPS 40 Dermatus - Base Facial Corretiva - Época Cosméticos - Época Cosméticos,Skin Plus Base Corretiva Aderente FPS 40 Dermatus - Base Facial Corretiva - Cor A,https://www.epocacosmeticos.com.br/skin-plus-base-corretiva-aderente-fps-40-dermatus-base-facial-corretiva/p
Skin Plus Base Corretiva Aderente FPS 40 Dermatus - Base Facial Corretiva - Época Cosméticos - Época Cosméticos,Skin Plus Base Corretiva Aderente FPS 40 Dermatus - Base Facial Corretiva - Cor B,https://www.epocacosmeticos.com.br/skin-plus-base-corretiva-aderente-fps-40-dermatus-base-facial-corretiva/p
Skin Plus Base Corretiva Aderente FPS 40 Dermatus - Base Facial Corretiva - Época Cosméticos - Época Cosméticos,Skin Plus Base Corretiva Aderente FPS 40 Dermatus - Base Facial Corretiva - Cor C,https://www.epocacosmeticos.com.br/skin-plus-base-corretiva-aderente-fps-40-dermatus-base-facial-corretiva/p
Skin Plus Base Corretiva Aderente FPS 40 Dermatus - Base Facial Corretiva - Época Cosméticos - Época Cosméticos,Skin Plus Base Corretiva Aderente FPS 40 Dermatus - Base Facial Corretiva - Cor D,https://www.epocacosmeticos.com.br/skin-plus-base-corretiva-aderente-fps-40-dermatus-base-facial-corretiva/p
Skin Plus Base Corretiva Aderente FPS 40 Dermatus - Base Facial Corretiva - Época Cosméticos - Época Cosméticos,Skin Plus Base Corretiva Aderente FPS 40 Dermatus - Base Facial Corretiva - Cor F,https://www.epocacosmeticos.com.br/skin-plus-base-corretiva-aderente-fps-40-dermatus-base-facial-corretiva/p
Skin Plus Base Corretiva Aderente FPS 40 Dermatus - Base Facial Corretiva - Época Cosméticos - Época Cosméticos,Skin Plus Base Corretiva Aderente FPS 40 Dermatus - Base Facial Corretiva - Cor E,https://www.epocacosmeticos.com.br/skin-plus-base-corretiva-aderente-fps-40-dermatus-base-facial-corretiva/p
Ecrinal Gel Émollient Cuticules - Época Cosméticos,Ecrinal Gel Émollient Cuticules - Tratamento para Cutículas - 10ml,https://www.epocacosmeticos.com.br/ecrinal-gel-emollient-cuticules-tratamento-para-cuticulas/p
Ecrinal Serum Réparateur - Reparador de Unhas - Época Cosméticos,Ecrinal Serum Réparateur - Reparador de Unhas - 10ml,https://www.epocacosmeticos.com.br/ecrinal-serum-reparateur-reparador-de-unhas/p
Ampoules Lifting Beaute du Teint Coup d'Éclat - Ampola Anti-idade - Época Cosméticos - Época Cosméticos,Ampoules Lifting Beaute du Teint Coup d'Éclat - Ampola Anti-idade - 12x 1ml,https://www.epocacosmeticos.com.br/ampoules-lifting-beaute-du-teint-coup-d-eclat-ampola-anti-idade/p
Sports Akileïne Nok Anti-Rubbing - Creme Protetor - Época Cosméticos,Sports Akileïne Nok Anti-Rubbing - Creme Protetor - 75ml,https://www.epocacosmeticos.com.br/sports-akileine-nok-anti-rubbing-creme-protetor/p
Sports Akileïne Relax Recovery Gel - Antifadiga Muscular - Época Cosméticos - Época Cosméticos,Sports Akileïne Relax Recovery Gel - Antifadiga Muscular - 75ml,https://www.epocacosmeticos.com.br/sports-akileine-relax-recovery-gel-antifadiga-muscular/p
Folcare Ds Shampoo Intensivo Melora - Shampoo Anticaspa - Época Cosméticos - Época Cosméticos,Folcare Ds Shampoo Intensivo Melora - Shampoo Anticaspa - 125ml,https://www.epocacosmeticos.com.br/folcare-ds-shampoo-intensivo-melora-shampoo-anticaspa/p
Folcare DS Condicionador Melora - Condicionador Anticaspa - Época Cosméticos - Época Cosméticos,Folcare DS Condicionador Melora - Condicionador Anticaspa - 200ml,https://www.epocacosmeticos.com.br/folcare-ds-melora-condicionador-anticaspa/p
SkinSec Darrow - Sabonete em Barra - Época Cosméticos - Época Cosméticos,SkinSec Darrow - Sabonete em Barra - 80g,https://www.epocacosmeticos.com.br/skinsec-darrow-sabonete-em-barra-80g/p
SkinSec Darrow - Sabonete Líquido - Época Cosméticos - Época Cosméticos,SkinSec Darrow - Sabonete Líquido - 140ml,https://www.epocacosmeticos.com.br/skinsec-darrow-sabonete-liquido/p
Green Espuma de Limpeza Dermatus - Espuma de Limpeza para a Pele - Época Cosméticos - Época Cosméticos,Green Espuma de Limpeza Dermatus - Espuma de Limpeza para a Pele - 60ml,https://www.epocacosmeticos.com.br/green-espuma-de-limpeza-dermatus-espuma-de-limpeza-para-a-pele/p
Sensisoft Dermatus - Hidratante Corporal - Época Cosméticos - Época Cosméticos,Sensisoft Dermatus - Hidratante Corporal - 250g,https://www.epocacosmeticos.com.br/sensisoft-dermatus-hidratante-corporal/p
Oil Control Dermatus - Shampoo para Cabelos Oleosos - Época Cosméticos - Época Cosméticos,Oil Control Dermatus - Shampoo para Cabelos Oleosos - 240ml,https://www.epocacosmeticos.com.br/oil-control-dermatus---shampoo-para-cabelos-oleosos/p
Brilho Intenso Dermatus - Época Cosméticos,Brilho Intenso Dermatus - Soro Iluminador para os Cabelos - 60ml,https://www.epocacosmeticos.com.br/brilho-intenso-dermatus-soro-iluminador-para-os-cabelos/p
Shampoo Brilho Intenso Dermatus - Época Cosméticos - Época Cosméticos,Brilho Intenso Dermatus - Shampoo Iluminador - 240ml,https://www.epocacosmeticos.com.br/brilho-intenso-dermatus-shampoo-iluminador/p
Zinc Plus Dermatus - Shampoo Anticaspa - Época Cosméticos - Época Cosméticos,Zinc Plus Dermatus - Shampoo Anticaspa - 200ml,https://www.epocacosmeticos.com.br/zinc-plus-dermatus-shampoo-anticaspa/p
D.Blanc Mini Peel Clareador Dermatus - Tratamento Antimanchas - Época Cosméticos - Época Cosméticos,D.Blanc Mini Peel Clareador Dermatus - Tratamento Antimanchas - 15ml,https://www.epocacosmeticos.com.br/d-blanc-mini-peel-clareador-dermatus-tratamento-antimanchas/p
Fortalecedor das Unhas Dermatus - Época Cosméticos,Loção Fortalecedora das Unhas Dermatus - Fortalecedor de Unhas - 9ml,https://www.epocacosmeticos.com.br/locao-fortalecedora-das-unhas-dermatus-fortalecedor-de-unhas/p
Ilumifly Hidratação Dermatus - Shampoo Hidratante - Época Cosméticos,Ilumifly Hidratação Dermatus - Shampoo Hidratante - 240ml,https://www.epocacosmeticos.com.br/ilumifly-hidratacao-dermatus-shampoo-hidratante/p
Zinc Plus Loção Capilar Dermatus - Tratamento Anticaspa - Época Cosméticos - Época Cosméticos,Zinc Plus Loção Capilar Dermatus - Tratamento Anticaspa - 50ml,https://www.epocacosmeticos.com.br/zinc-plus-locao-capilar-dermatus-tratamento-anticaspa/p
ZeroAK Loção de Limpeza Dermatus - Tratamento Desobstrutor de Poros - Época Cosméticos - Época Cosméticos,ZeroAK Loção de Limpeza Dermatus - Tratamento Desobstrutor de Poros - 120ml,https://www.epocacosmeticos.com.br/zeroak-locao-de-limpeza-dermatus-tratamento-desobstrutor-de-poros/p
ZeroAK Limpeza Profunda 2 em 1 Dermatus - Gel de Limpeza e Máscara Fácial - Época Cosméticos - Época Cosméticos,ZeroAK Limpeza Profunda 2 em 1 Dermatus - Gel de Limpeza e Máscara Fácial - 120g,https://www.epocacosmeticos.com.br/zeroak-limpeza-profunda-2-em-1-dermatus-gel-de-limpeza-e-mascara-facial/p
ZeroAK Spray para o Corpo Dermatus - Tratamento Antiacne - Época Cosméticos - Época Cosméticos,ZeroAK Spray para o Corpo Dermatus - Tratamento Antiacne - 40ml,https://www.epocacosmeticos.com.br/zeroak-spray-para-o-corpo-dermatus-tratamento-antiacne/p
S.O.S Oil Dose Dermatus - Hidratante Capilar e Corporal - Época Cosméticos,S.O.S Oil Dose Dermatus - Hidratante Capilar e Corporal - 30ml,https://www.epocacosmeticos.com.br/sos-oil-dose-dermatus-hidratante-capilar-e-corporal/p
Leave On Loção sem Enxágue Dermatus - Loção de Alisamento Temporário - Época Cosméticos - Época Cosméticos,Leave On Loção sem Enxágue Dermatus - Loção de Alisamento Temporário - 120ml,https://www.epocacosmeticos.com.br/leave-on-locao-sem-enxague-dermatus-locao-de-alisamento-temporario/p
Ilumifly Nutrição Intensiva Dermatus - Shampoo Nutritivo - Época Cosméticos - Época Cosméticos,Ilumifly Nutrição Intensiva Dermatus - Shampoo Nutritivo - 240ml,https://www.epocacosmeticos.com.br/ilumifly-nutricao-intensiva-dermatus-shampoo-nutritivo/p
Ilumifly Nutrição Intensa Dermatus - Soro Nutritivo para os Cabelos - Época Cosméticos,Ilumifly Nutrição Intensa Dermatus - Soro Nutritivo para os Cabelos - 140ml,https://www.epocacosmeticos.com.br/ilumifly-nutricao-intensa-dermatus-soro-nutritivo-para-os-cabelos/p
Ilumifly Nutrição Intensa Dermatus - Máscara Nutritiva - Época Cosméticos - Época Cosméticos,Ilumifly Nutrição Intensa Dermatus - Máscara Nutritiva - 150g,https://www.epocacosmeticos.com.br/ilumifly-nutricao-intensa-dermatus-mascara-nutritiva/p
Ilumifly Hidratação Dermatus - Máscara Hidratante para os Cabelos - Época Cosméticos,Ilumifly Hidratação Dermatus - Máscara Hidratante para os Cabelos - 150g,https://www.epocacosmeticos.com.br/ilumifly-hidratacao-dermatus-mascara-hidratante-para-os-cabelos/p
Velvet para as Mãos Dermatus Hidratante - Época Cosméticos,Velvet para as Mãos Dermatus - Hidratante para as Mãos - 50g,https://www.epocacosmeticos.com.br/velvet-para-as-maos-dermatus-hidratante-para-as-maos/p
Sensiplus Castanha e Macadâmia Dermatus - Época Cosméticos,Sensiplus Castanha do Brasil e Macadâmia Dermatus - Sabonote Líquido - 250ml,https://www.epocacosmeticos.com.br/sensiplus-castanha-do-brasil-e-macadamia-dermatus-sabonote-liquido/p
Sensiplus Camomila e Alfa Bisabolol Dermatus - Época Cosméticos,Sensiplus Camomila e Alfa Bisabolol Dermatus - Sabonete Líquido - 250ml,https://www.epocacosmeticos.com.br/sensiplus-camomila-e-alfa-bisabolol-dermatus-sabonete-liquido/p
Sensiplus Face e Corpo Dermatus - Época Cosméticos,Sensiplus Loção Face e Corpo Dermatus - Hidratante Facial e Corporal - 150ml,https://www.epocacosmeticos.com.br/sensiplus-locao-face-e-corpo-dermatus-hidratante-facial-e-corporal/p
Sensiplus Multireparador Dermatus - Época Cosméticos,Sensiplus Multireparador Dermatus - Hidratante Corporal - 18g,https://www.epocacosmeticos.com.br/sensiplus-multireparador-dermatus-hidratante-corporal/p
Scalp Clean Dermatus - Espuma para Limpeza Capilar - Época Cosméticos - Época Cosméticos,Scalp Clean Dermatus - Espuma para Limpeza Capilar - 100ml,https://www.epocacosmeticos.com.br/scalp-clean-dermatus-espuma-para-limpeza-capilar/p
Loção Hidratante Corporal Água de Coco Dermatus - Hidratante Corporal - Época Cosméticos,Loção Hidratante Corporal Água de Coco Dermatus - Hidratante Corporal - 200ml,https://www.epocacosmeticos.com.br/locao-hidratante-corporal-agua-de-coco-dermatus-hidratante-corporal/p
Loção com Camomila Matricária Dermatus - Época Cosméticos,Loção Facial com Camomila Matricária Dermatus - Tônico Facial - 120ml,https://www.epocacosmeticos.com.br/locao-facial-com-camomila-matricaria-dermatus-tonico-facial/p
Photoplus Loção FPS30 Dermatus - Protetor Solar - Época Cosméticos - Época Cosméticos,Photoplus Loção FPS30 Dermatus - Protetor Solar - 120ml,https://www.epocacosmeticos.com.br/photoplus-locao-fps30-dermatus-protetor-solar/p
Oil Control Esfoliante Capilar Dermatus - Tratamento Esfoliante do Couro Cabeludo - Época Cosméticos - Época Cosméticos,Oil Control Esfoliante Capilar Dermatus - Tratamento Esfoliante do Couro Cabeludo - 150g,https://www.epocacosmeticos.com.br/oil-control-esfoliante-capilar-dermatus-tratamento-esfoliante-do-couro-cabeludo/p
Lac Plus Loção Hidratante Dermatus - Hidratante Corporal - Época Cosméticos - Época Cosméticos,Lac Plus Loção Hidratante Dermatus - Hidratante Corporal - 150ml,https://www.epocacosmeticos.com.br/lac-plus-locao-hidratante-dermatus-hidratante-corporal/p
