title,product name,url
Traitement Anti-Transpirant 48h Vichy - Desodorante Roll On - Época Cosméticos - Época Cosméticos,Traitement Anti-Transpirant 48h Vichy - Desodorante Roll On - 50ml,https://www.epocacosmeticos.com.br/traitement-anti-transpirant-48h-vichy-desodorante-roll-on/p
Minesol Actif Unify Tinted Mousse Light Fps30 Roc - Protetor Solar - Época Cosméticos - Época Cosméticos,Minesol Actif Unify Tinted Mousse Light Fps30 Roc - Protetor Solar - 40g,https://www.epocacosmeticos.com.br/minesol-actif-unify-tinted-mousse-light-fps30-roc-protetor-solar/p
Duo Retix Woman Sérum Melora -Tratamento Antiacne - Época Cosméticos - Época Cosméticos,Duo Retix Woman Sérum Melora -Tratamento Antiacne - 30g,https://www.epocacosmeticos.com.br/duo-retix-woman-serum-melora-tratamento-antiacne/p
Protetor Solar Facial com Cor de Base Fps60 Actsun Color - Protetor Solar - Época Cosméticos - Época Cosméticos,Protetor Solar Facial com Cor de Base Fps60 Actsun Color - Protetor Solar - Universal,https://www.epocacosmeticos.com.br/protetor-solar-facial-com-cor-de-base-fps60-actsun-color-protetor-solar/p
Protetor Solar Facial Fps30 Actsun - Protetor Solar - Época Cosméticos - Época Cosméticos,Protetor Solar Facial Fps30 Actsun - Protetor Solar - 60ml,https://www.epocacosmeticos.com.br/protetor-solar-facial-fps30-actsun-protetor-solar/p
C-Supérieur Gel Creme Anti-Oxidante Roc - Tratamento Anti-Idade - Época Cosméticos,C-Supérieur Gel Creme Anti-Oxidante Roc - Tratamento Anti-Idade para Área dos Olhos - 15g,https://www.epocacosmeticos.com.br/c-superieur-gel-creme-anti-oxidante-roc-tratamento-anti-idade/p
Pro-Renove Anti-Ageing Unifying Fluid Roc - Fluido de Tratamento Anti-Idade - Época Cosméticos,Pro-Renove Anti-Ageing Unifying Fluid Roc - Fluido de Tratamento Anti-Idade - 40ml,https://www.epocacosmeticos.com.br/pro-renove-anti-ageing-unifying-fluid-roc-fluido-de-tratamento-anti-idade/p
Pro-Correct Fluído Antirrugas Roc - Rejuvenescedor Facial - Época Cosméticos,Pro-Correct Fluído Antirrugas Roc - Rejuvenescedor Facial - 40ml,https://www.epocacosmeticos.com.br/pro-correct-fluido-antirrugas-roc-rejuvenescedor-facial/p
Pro-Correct Concentrate Intensive Roc - Tratamento Facial Antirrugas - Época Cosméticos,Pro-Correct Concentrate Intensive Roc - Tratamento Facial Antirrugas - 30ml,https://www.epocacosmeticos.com.br/pro-correct-concentrate-intensive-roc-tratamento-facial-antirrugas/p
Pro-Define Concentrado Roc - Rejuvenescedor Facial - Época Cosméticos,Pro-Define Concentrado Roc - Rejuvenescedor Facial - 50ml,https://www.epocacosmeticos.com.br/pro-define-concentrado-roc-rejuvenescedor-facial/p
Minesol Actif Unify Gel Creme FPS 80 Roc - Protetor Solar - Época Cosméticos - Época Cosméticos,Minesol Actif Unify Gel Creme FPS 80 Roc - Protetor Solar - 50g,https://www.epocacosmeticos.com.br/minesol-actif-unify-gel-creme-fps-80-roc-protetor-solar/p
Duocap Innéov - Suplemento Anticaspa - Época Cosméticos,Duocap Innéov - Suplemento Anticaspa - 30 Cápsulas,https://www.epocacosmeticos.com.br/duocap-inneov-suplemento-anticaspa/p
Dermablend Pó Fixador Vichy - Pó Translúcido - Época Cosméticos - Época Cosméticos,Dermablend Pó Fixador Vichy - Pó Translúcido - Translucido,https://www.epocacosmeticos.com.br/dermablend-po-fixador-vichy-po-translucido/p
Dermablend Corretivo FPS 30 Vichy - Corretivo Facial - Época Cosméticos - Época Cosméticos,Dermablend Corretivo FPS 30 Vichy - Corretivo Facial - 55 - Bronze,https://www.epocacosmeticos.com.br/dermablend-corretivo-fps-30-vichy-corretivo-facial/p
Dermablend Corretivo FPS 30 Vichy - Corretivo Facial - Época Cosméticos - Época Cosméticos,Dermablend Corretivo FPS 30 Vichy - Corretivo Facial - 15 - Opal,https://www.epocacosmeticos.com.br/dermablend-corretivo-fps-30-vichy-corretivo-facial/p
Dermablend Corretivo FPS 30 Vichy - Corretivo Facial - Época Cosméticos - Época Cosméticos,Dermablend Corretivo FPS 30 Vichy - Corretivo Facial - 25 - Nude,https://www.epocacosmeticos.com.br/dermablend-corretivo-fps-30-vichy-corretivo-facial/p
Dermablend Corretivo FPS 30 Vichy - Corretivo Facial - Época Cosméticos - Época Cosméticos,Dermablend Corretivo FPS 30 Vichy - Corretivo Facial - 35 - Sand,https://www.epocacosmeticos.com.br/dermablend-corretivo-fps-30-vichy-corretivo-facial/p
Dermablend Corretivo FPS 30 Vichy - Corretivo Facial - Época Cosméticos - Época Cosméticos,Dermablend Corretivo FPS 30 Vichy - Corretivo Facial - 45 - Gold,https://www.epocacosmeticos.com.br/dermablend-corretivo-fps-30-vichy-corretivo-facial/p
Sustent C Protege Ada Tina - Rejuvenescedor Facial - Época Cosméticos,Sustent C Protege Ada Tina - Rejuvenescedor Facial - 30ml,https://www.epocacosmeticos.com.br/sustent-c-protege-ada-tina-rejuvenescedor-facial/p
Rejuvenescedor Facial Ada Tina - Pure C 20 Mousse - Época Cosméticos,Rejuvenescedor Facial Ada Tina - Pure C 20 Mousse - 30ml,https://www.epocacosmeticos.com.br/rejuvenescedor-facial-ada-tina-pure-c-20-mousse/p
Serum Hidratante Hydrance Optimale Avène - Hidratante Facial - Época Cosméticos - Época Cosméticos,Serum Hidratante Hydrance Optimale Avène - Hidratante Facial - 30ml,https://www.epocacosmeticos.com.br/serum-hidratante-hydrance-optimale-avene/p
Antriperspirante Loção para os Pés Perspirex - Época Cosméticos,Antiperspirante Loção para os Pés Perspirex - Tratamento para Transpiração e Odores - 100ml,https://www.epocacosmeticos.com.br/antiperspirante-locao-para-os-pes-perspirex-locao-antiperspirante/p
Photoplus Base Fotoprotetora FPS50 Dermatus - Época Cosméticos,Photoplus Base Fotoprotetora FPS50 Dermatus - Base Facial Corretiva - Bege Claro,https://www.epocacosmeticos.com.br/photoplus-base-fotoprotetora-fps50-dermatus-base-facial-corretiva/p
Photoplus Base Fotoprotetora FPS50 Dermatus - Época Cosméticos,Photoplus Base Fotoprotetora FPS50 Dermatus - Base Facial Corretiva - Bege Médio,https://www.epocacosmeticos.com.br/photoplus-base-fotoprotetora-fps50-dermatus-base-facial-corretiva/p
Actine Darrow - Loção Adstringente - Época Cosméticos - Época Cosméticos,Actine Darrow - Loção Adstringente - 190ml,https://www.epocacosmeticos.com.br/actine-darrow-locao-adstringente-100ml/p
Actine Darrow - Esfoliante Facial - Época Cosméticos - Época Cosméticos,Actine Darrow - Esfoliante Facial - 60ml,https://www.epocacosmeticos.com.br/actine-darrow-esfoliante-facial/p
Resveratrol B E Antioxidante Night SkinCeuticals - Época Cosméticos,Resveratrol B E Antioxidante Night SkinCeuticals - Reparador Celular - 30ml,https://www.epocacosmeticos.com.br/resveratrol-b-e-antioxidante-night-skinceuticals-reparador-celular/p
Anthelios BB Cream La Roche-Posay - Base Facial - Época Cosméticos - Época Cosméticos,Anthelios BB Cream La Roche-Posay - Base Facial - Natural,https://www.epocacosmeticos.com.br/anthelios-bb-cream-la-roche-posay-base-facial/p
D-Pigment Légère Avène - Tratamento Antimanchas - Época Cosméticos,D-Pigment Légère Avène - Tratamento Antimanchas - 30ml,https://www.epocacosmeticos.com.br/d-pigment-legere-avene-tratamento-antimanchas/p
Ideal Finish Rollon Vichy - Desodorante Feminino - Época Cosméticos,Ideal Finish Rollon Vichy - Desodorante Feminino - 50ml,https://www.epocacosmeticos.com.br/ideal-finish-rollon-vichy-desodorante-feminino/p
A.G.E Interrupter Skinceuticals - Rejuvenescedor Facial - Época Cosméticos,A.G.E Interrupter Skinceuticals - Rejuvenescedor Facial - 48g,https://www.epocacosmeticos.com.br/a-g-e-interrupter-skinceuticals-rejuvenescedor-facial/p
Pó Compacto Sun Marine Color FPS50 de Biomarine - Época Cosméticos - Época Cosméticos,Sun Marine Color Compacto FPS50 Biomarine - Pó Compacto 12g - Natural,https://www.epocacosmeticos.com.br/sun-marine-color-compacto-fps-50-biomarine-po-compacto/p
Pó Compacto Sun Marine Color FPS50 de Biomarine - Época Cosméticos - Época Cosméticos,Sun Marine Color Compacto FPS50 Biomarine - Pó Compacto 12g - Chocolate,https://www.epocacosmeticos.com.br/sun-marine-color-compacto-fps-50-biomarine-po-compacto/p
Pó Compacto Sun Marine Color FPS50 de Biomarine - Época Cosméticos - Época Cosméticos,Sun Marine Color Compacto FPS50 Biomarine - Pó Compacto 12g - Bege,https://www.epocacosmeticos.com.br/sun-marine-color-compacto-fps-50-biomarine-po-compacto/p
Pó Compacto Sun Marine Color FPS50 de Biomarine - Época Cosméticos - Época Cosméticos,Sun Marine Color Compacto FPS50 Biomarine - Pó Compacto 12g - Bronze,https://www.epocacosmeticos.com.br/sun-marine-color-compacto-fps-50-biomarine-po-compacto/p
Purif-AC Roc - Limpador Facial - Época Cosméticos - Época Cosméticos,Purif-AC Roc - Limpador Facial - 80ml,https://www.epocacosmeticos.com.br/purif-ac-roc-limpador-facial/p
Melora C Max - Rejuvenescedor para o Contorno dos Olhos - Época Cosméticos,Melora C Max - Rejuvenescedor para o Contorno dos Olhos - 15g,https://www.epocacosmeticos.com.br/melora-c-max--rejuvenescedor-para-o-contorno-dos-olhos/p
Endocare Tensage Cream Endocare - Rejuvenescedor Facial - Época Cosméticos,Endocare Tensage Cream Endocare - Rejuvenescedor Facial - 30ml,https://www.epocacosmeticos.com.br/endocare-tensage-cream-endocare-rejuvenescedor-facial/p
Dual Clear Diurno Ada Tina - Clareador Facial - Fps 30 - Época Cosméticos,Dual Clear Diurno Ada Tina - Clareador Facial - Fps 30 - 30ml,https://www.epocacosmeticos.com.br/dual-clear-diurno-ada-tina-clareador-facial-fps-30/p
Dmae Facial Natupele - Rejuvenescedor Facial - Época Cosméticos,Dmae Facial Natupele - Rejuvenescedor Facial - 30g,https://www.epocacosmeticos.com.br/dmae-facial-natupele-rejuvenescedor-facial/p
Tratamento para Unhas Onic Gengibre Derma Nail - Época Cosméticos,Derma Nail Onic Gengibre Derma Nail - Tratamento para Unhas Roídas - Kit,https://www.epocacosmeticos.com.br/derma-nail-onic-gengibre-derma-nail-tratamento-para-unhas-roidas/p
DermOne Futura Biotech Roll-on - Desodorante - Época Cosméticos,DermOne Futura Biotech Roll-on - Desodorante Antitranspirante - 65ml,https://www.epocacosmeticos.com.br/dermone-futura-biotech-roll-on-desodorante-antitranspirante/p
Cicalfate Crème Réparatrice Avène - Hidratante Facial - Época Cosméticos,Cicalfate Crème Réparatrice Avène - Hidratante Facial - 40ml,https://www.epocacosmeticos.com.br/cicalfate-creme-reparatrice-avene-hidratante-facial/p
Cicalfate Crème Réparatrice Avène - Hidratante Facial - Época Cosméticos,Cicalfate Crème Réparatrice Avène - Hidratante Facial - 100ml,https://www.epocacosmeticos.com.br/cicalfate-creme-reparatrice-avene-hidratante-facial/p
Amplexe Shampoo Antiqueda Ada Tina - Shampoo Antiqueda - Época Cosméticos,Amplexe Shampoo Antiqueda Ada Tina - Shampoo Antiqueda - 100ml,https://www.epocacosmeticos.com.br/amplexe-shampoo-antiqueda-ada-tina-shampoo-antiqueda/p
Amplexe Loção Antiqueda Ada Tina - Época Cosméticos,Amplexe Antiqueda Ada Tina - Tratamento Antiqueda - 50ml,https://www.epocacosmeticos.com.br/amplexe-antiqueda-ada-tina-tratamento-antiqueda/p
Tioglic Stick Natupele - Tratamento Suavizante de Olheiras - Época Cosméticos,Tioglic Stick Natupele - Tratamento Suavizante de Olheiras - 4g,https://www.epocacosmeticos.com.br/tioglic-stick-natupele-tratamento-suavizante-de-olheiras/p
"SkinCeuticals Retinol 0,3 - Creme Anti-Idade Noturno - Época Cosméticos","Retinol 0,3 SkinCeuticals - Rejuvenescedor Facial - 30ml",https://www.epocacosmeticos.com.br/retinol-0-3-skinceuticals-rejuvenescedor-facial/p
Reative C Natupele - Rejuvenescedor Facial - Época Cosméticos,Reative C Natupele - Rejuvenescedor Facial - 30g,https://www.epocacosmeticos.com.br/reative-c-natupele-rejuvenescedor-facial/p
Purete Thermale Vichy - Limpador Facial - Época Cosméticos,Purete Thermale Vichy - Limpador Facial - 150ml,https://www.epocacosmeticos.com.br/purete-thermale-vichy-limpador-facial/p
Pure C 5 Ada Tina - Rejuvenescedor Facial - Época Cosméticos,Pure C 5 Ada Tina - Rejuvenescedor Facial - 30ml,https://www.epocacosmeticos.com.br/pure-c-ada-tina-rejuvenescedor-facial/p
Normalize Pore Fps 25 Ada Tina - Protetor Solar - Época Cosméticos,Normalize Pore Fps 25 Ada Tina - Protetor Solar - 50ml,https://www.epocacosmeticos.com.br/normalize-pore-fps-25-ada-tina-protetor-solar-facial/p
Normalize Fps 30 Ada Tina - Protetor Solar - Época Cosméticos,Normalize Fps 30 Ada Tina - Protetor Solar - 50ml,https://www.epocacosmeticos.com.br/normalize-fps-30-ada-tina-protetor-solar/p
Neostrata Gel Clareador Neostrata - Gel Despigmentante Facial - Época Cosméticos,Neostrata Gel Clareador Neostrata - Gel Despigmentante Facial - 40g,https://www.epocacosmeticos.com.br/neostrata-gel-clareador-neostrata-gel-despigmentante-facial/p
Minesol Antioxidant FPS70 Roc - Época Cosméticos,Minesol Antioxidant Fps 70 Roc - Protetor Solar - 50g,https://www.epocacosmeticos.com.br/minesol-antioxidant-fps-70-roc-protetor-solar/p
Minesol Actif Unify Fps 60 Roc - Protetor Solar Facial - Época Cosméticos,Minesol Actif Unify Fps 60 Roc - Protetor Solar Facial - 50g,https://www.epocacosmeticos.com.br/minesol-actif-unify-fps-60-roc-protetor-solar-facial/p
Melanesse Manutenção Natupele - Tratamento Clareador - Época Cosméticos,Melanesse Manutenção Natupele - Tratamento Clareador - 15g,https://www.epocacosmeticos.com.br/melanesse-manutencao-natupele-tratamento-clareador/p
Melanesse Manutenção Natupele - Tratamento Clareador - Época Cosméticos,Melanesse Manutenção Natupele - Tratamento Clareador - 30g,https://www.epocacosmeticos.com.br/melanesse-manutencao-natupele-tratamento-clareador/p
Kerium Máscara Capilar La Roche Posay - Época Cosméticos,Kerium Máscara Capilar La Roche Posay - Máscara Hidratante para os Cabelos - 200ml,https://www.epocacosmeticos.com.br/kerium-mascara-capilar-la-roche-posay-mascara-hidratante-para-os-cabelos/p
Kerium Ds La Roche Posay - Shampoo Anticaspa - Época Cosméticos,Kerium Ds La Roche Posay - Shampoo Anticaspa de Ação Intensiva - 125ml,https://www.epocacosmeticos.com.br/kerium-ds-la-roche-posay-shampoo-anticaspa-de-acao-intensiva/p
Hydrance Optimale Fps 20 Avène - Hidratante Facial - Época Cosméticos,Hydrance Optimale Fps 20 Avène - Hidratante Facial - 40ml,https://www.epocacosmeticos.com.br/hydrance-optimale-fps-20-avene-hidratante-facial/p
Gel Plus Neostrata - Rejuvenescedor Facial - Época Cosméticos,Gel Plus Neostrata - Rejuvenescedor Facial - 100ml,https://www.epocacosmeticos.com.br/gel-plus-neostrata-rejuvenescedor-facial/p
Máscara de Tratamento Dermage Revitrat Omegaplex Mask - Época Cosméticos,Dermage Revitrat Omegaplex Mask Máscara de Tratamento - 2 Unidades,https://www.epocacosmeticos.com.br/dermage-revitrat-omegaplex-mask-mascara-de-tratamento-15g/p
Kit Imecap Hair Queda Intensa - Creme + Cápsulas - Época Cosméticos,Imecap Hair Queda Intensa Kit - Creme + Cápsulas,https://www.epocacosmeticos.com.br/kit-imecap-hair-queda-intensa---creme---capsulas/p
Protetor Solar Avène - Emulsão Solar FPS 70 - Época Cosméticos,Protetor Solar Avène - Emulsão Solar Toque Seco FPS 70 - 50ml,https://www.epocacosmeticos.com.br/protetor-solar-avene-emulsao-solar-fps-70/p
Sabonete Líquido Facial Darrow - Actine Control - Época Cosméticos,Sabonete Líquido Facial Darrow - Actine Control - 60ml,https://www.epocacosmeticos.com.br/sabonete-liquido-facial-darrow-actine-control/p
Kit La Roche-Posay Solução Micelar Ultra - 200ml + 100ml - Época Cosméticos,La Roche-Posay Solução Micelar Ultra Kit -  200ml + 100ml,https://www.epocacosmeticos.com.br/la-roche-posay-solucao-micelar-ultra-kit-200ml-100ml/p
Gel de Limpeza Facial Bioderma - Sensibio Gel Moussant - Época Cosméticos,Gel de Limpeza Facial Bioderma - Sensibio Gel Moussant - 200ml,https://www.epocacosmeticos.com.br/gel-de-limpeza-facial-bioderma-sensibio-gel-moussant/p
Kit Bayer Bepantol - Hidratante para Áreas Específicas + Hidratante Labial - Época Cosméticos,Bayer Bepantol Kit - Hidratante para Áreas Específicas + Hidratante Labial,https://www.epocacosmeticos.com.br/bayer-bepantol-kit-hidratante-para-areas-especificashidratante-labial/p
Tônico Facial Under Skin - Perfect Balance Toner - Época Cosméticos,Tônico Facial Under Skin - Perfect Balance Toner - 200ml,https://www.epocacosmeticos.com.br/tonico-facial-under-skin-perfect-balance-toner/p
Tônico Facial Under Skin - Perfect Hydra Calming Toner - Época Cosméticos,Tônico Facial Under Skin - Perfect Hydra Calming Toner - 200ml,https://www.epocacosmeticos.com.br/tonico-facial-under-skin-perfect-hydra-calming-toner/p
Protetor Solar Compacto Ada Tina - Biosole BB Cream Secco FPS 60 - Época Cosméticos,Protetor Solar Compacto Ada Tina - Biosole BB Cream Secco FPS 60 - Miele,https://www.epocacosmeticos.com.br/protetor-solar-compacto-ada-tina---biosole-bb-cream-secco-fps-60/p
Protetor Solar Compacto Ada Tina - Biosole BB Cream Secco FPS 60 - Época Cosméticos,Protetor Solar Compacto Ada Tina - Biosole BB Cream Secco FPS 60 - Noce,https://www.epocacosmeticos.com.br/protetor-solar-compacto-ada-tina---biosole-bb-cream-secco-fps-60/p
Protetor Solar Compacto Ada Tina - Biosole BB Cream Secco FPS 60 - Época Cosméticos,Protetor Solar Compacto Ada Tina - Biosole BB Cream Secco FPS 60 - Bianco,https://www.epocacosmeticos.com.br/protetor-solar-compacto-ada-tina---biosole-bb-cream-secco-fps-60/p
Protetor Solar Compacto Ada Tina - Biosole BB Cream Secco FPS 60 - Época Cosméticos,Protetor Solar Compacto Ada Tina - Biosole BB Cream Secco FPS 60 - Vaniglia,https://www.epocacosmeticos.com.br/protetor-solar-compacto-ada-tina---biosole-bb-cream-secco-fps-60/p
Shampoo Antioleosidade Vichy Dercos - Época Cosméticos,Vichy Dercos Shampoo Antioleosidade - 200ml,https://www.epocacosmeticos.com.br/vichy-dercos-shampoo-antioleosidade/p
Protetor Solar Cor Clara La Roche-Posay- Anthelios Fps 60 - Época Cosméticos,Protetor Solar Cor Clara La Roche-Posay - Anthelios Fps 60 - Claro,https://www.epocacosmeticos.com.br/protetor-solar-cor-clara-la-roche-posay-anthelios-fps-60/p
Protetor Solar Facial Avène Cleanance FPS50+ - Época Cosméticos,Protetor Solar Facial Avène Cleanance FPS50+ - 50ML,https://www.epocacosmeticos.com.br/protetor-solar-facial-avene-cleanance-fps50-/p
Loção Hidratante Avène TriXera Nutrition - Época Cosméticos,Loção Hidratante Avène TriXera Nutrition - 200ml,https://www.epocacosmeticos.com.br/locao-hidratante-avene-trixera-nutrition/p
Sérénage Avène - Emulsão Anti-idade Contorno dos Olhos - Época Cosméticos,Sérénage Avène - Emulsão Anti-idade Contorno dos Olhos - 15ml,https://www.epocacosmeticos.com.br/serenage-avene-emulsao-anti-idade-contorno-dos-olhos/p
Réflexe Solaire FPS50 Avène - Protetor Solar Facial - Época Cosméticos,Réflexe Solaire FPS50 Avène - Protetor Solar Facial - 30ml,https://www.epocacosmeticos.com.br/reflexe-solaire-fps50-avene-protetor-solar-facial/p
Cleanance Mat Avène - Loção Tônica - Época Cosméticos,Cleanance Mat Avène - Loção Tônica - 200ml,https://www.epocacosmeticos.com.br/cleanance-mat-avene-locao-tonica/p
Cleanance Hydra Avène - Creme Suavizante - Época Cosméticos,Cleanance Hydra Avène - Creme Suavizante - 40ml,https://www.epocacosmeticos.com.br/cleanance-hydra-avene-creme-suavizante/p
Suplemento Vitamínico e Mineral Masculino Intlab Beard Caps - Época Cosméticos,Suplemento Vitamínico e Mineral Masculino Intlab Beard Caps - 60 Cápsulas,https://www.epocacosmeticos.com.br/suplemento-vitaminico-e-mineral-masculino-intlab-beard-caps/p
Klassis Emulgel Theraskin - Creme Clareador FPS20 - Época Cosméticos,Klassis Emulgel Theraskin - Creme Clareador FPS20 - 30g,https://www.epocacosmeticos.com.br/klassis-emulgel-theraskin-creme-clareador-fps-20/p
Bepantol Baby Maxi Turbo Bayer - Creme Preventivo de Assaduras - Época Cosméticos,Bepantol Baby Maxi Turbo Bayer - Creme Preventivo de Assaduras - 60g,https://www.epocacosmeticos.com.br/bepantol-baby-maxi-turbo-bayer-creme-preventivo-de-assaduras/p
Bepantol Baby Bayer - Creme Preventivo de Assaduras - Época Cosméticos,Bepantol Baby Bayer - Creme Preventivo de Assaduras - 30g,https://www.epocacosmeticos.com.br/bepantol-baby-bayer-creme-preventivo-de-assaduras/p
Bepantol Baby Bayer - Creme Preventivo de Assaduras - Época Cosméticos,Bepantol Baby Bayer - Creme Preventivo de Assaduras - 100g,https://www.epocacosmeticos.com.br/bepantol-baby-bayer-creme-preventivo-de-assaduras/p
Anthelios XL FPS 30 La Roche Posay - Protetor Solar - Época Cosméticos,Anthelios XL FPS 30 La Roche Posay - Protetor Solar Fluído - 120ml,https://www.epocacosmeticos.com.br/anthelios-xl-fps-30-la-roche-posay-protetor-solar-fluido/p
Anthelios XL FPS 30 La Roche Posay - Protetor Solar - Época Cosméticos,Anthelios XL FPS 30 La Roche Posay - Protetor Solar Fluído - 200ml,https://www.epocacosmeticos.com.br/anthelios-xl-fps-30-la-roche-posay-protetor-solar-fluido/p
Creme Anti-Idade Ivy C - Rejuvenescedor Para Contorno dos Olhos - Época Cosméticos - Época Cosméticos,Creme Anti-Idade Ivy C - Rejuvenescedor Para Contorno dos Olhos - 15g,https://www.epocacosmeticos.com.br/creme-anti-idade-ivy-c-rejuvenescedor-para-contorno-dos-olhos/p
Blancy Olhos Agecare - Creme Clareador de Olheiras - Época Cosméticos,Blancy Olhos Agecare - Creme Clareador de Olheiras - 15g,https://www.epocacosmeticos.com.br/blancy-olhos-agecare-creme-clareador-de-olheiras/p
Sébium Global Bioderma - Tratamento para Acne - Época Cosméticos - Época Cosméticos,Sébium Global Bioderma - Tratamento para Acne - 30ml,https://www.epocacosmeticos.com.br/sebium-global-bioderma-tratamento-para-acne/p
Idéal Soleil FPS 50 Hidratação Vichy - Protetor Solar Corporal - Época Cosméticos - Época Cosméticos,Idéal Soleil FPS 50 Hidratação Vichy - Protetor Solar Corporal - 200ml,https://www.epocacosmeticos.com.br/ideal-soleil-fps-50-hidratacao-vichy-protetor-solar-corporal/p
Máscara Limpeza Clarifying Clay Masque SkinCeuticals - Época Cosméticos,Clarifying Clay Masque SkinCeuticals - Máscara de Limpeza - 60ml,https://www.epocacosmeticos.com.br/clarifying-clay-masque-skinceuticals-mascara-de-limpeza/p
Dry Protection Suvo - Loção Antitraspirante - Época Cosméticos,Dry Protection Suvo - Loção Antitraspirante - 100ml,https://www.epocacosmeticos.com.br/dry-protection-suvo-locao-antitraspirante/p
Powerfit Colágeno Hidrolisado Caps Nutrilatina - Época Cosméticos,Powerfit Colágeno Hidrolisado Caps Nutrilatina - Suplemento - 60 Cápsulas,https://www.epocacosmeticos.com.br/powerfit-colageno-hidrolisado-caps-nutrilatina-suplemento/p
Aquaporin Active Contorno dos Olhos Eucerin - Creme Hidratante - Época Cosméticos - Época Cosméticos,Aquaporin Active Contorno dos Olhos Eucerin - Creme Hidratante - 15ml,https://www.epocacosmeticos.com.br/aquaporin-active-contorno-dos-olhos-eucerin-creme-hidratante/p
Hyaluron-Filler Dia Eucerin - Creme Antirrugas - Época Cosméticos - Época Cosméticos,Hyaluron-Filler Dia Eucerin - Creme Anti-Rugas - 51g,https://www.epocacosmeticos.com.br/hyaluron-filler-dia-eucerin-creme-anti-rugas/p
Beauty Care Cicatricure - Creme Multibeneficios - Época Cosméticos,Beauty Care Cicatricure - Creme Multibeneficios - 50g,https://www.epocacosmeticos.com.br/beauty-care-cicatricure-creme-multibeneficios/p
Atoderm Gel Douche Bioderma - Higienizador ultra-suave - Época Cosméticos - Época Cosméticos,Atoderm Gel Douche Bioderma - Higienizador ultra-suave - 500ml,https://www.epocacosmeticos.com.br/atoderm-gel-douche-bioderma-higienizador-ultra-suave/p
Depore Peels Ada Tina - Gel de Limpeza - Época Cosméticos - Época Cosméticos,Depore Peels Ada Tina - Gel de Limpeza - 100g,https://www.epocacosmeticos.com.br/depore-peels-ada-tina-gel-de-limpeza/p
Depore Mask Ada Tina - Máscara de Limpeza - Época Cosméticos - Época Cosméticos,Depore Mask Ada Tina - Máscara de Limpeza - 100ml,https://www.epocacosmeticos.com.br/depore-mask-ada-tina-mascara-de-limpeza/p
Depore Clean Ada Tina - Gel de Limpeza - Época Cosméticos - Época Cosméticos,Depore Clean Ada Tina - Gel de Limpeza - 100g,https://www.epocacosmeticos.com.br/depore-clean-ada-tina-gel-de-limpeza/p
Eau Thermale Lotion Micellaire Netoyante Démaquillante Avène - Limpador Facial - Época Cosméticos - Época Cosméticos,Eau Thermale Lotion Micellaire Netoyante Démaquillante Avène - Limpador Facial - 100ml,https://www.epocacosmeticos.com.br/eau-thermale-lotion-micellaire-netoyante-demaquillante-avene-limpador-facial/p
Eau Thermale Lotion Micellaire Netoyante Démaquillante Avène - Limpador Facial - Época Cosméticos - Época Cosméticos,Eau Thermale Lotion Micellaire Netoyante Démaquillante Avène - Limpador Facial - 200ml,https://www.epocacosmeticos.com.br/eau-thermale-lotion-micellaire-netoyante-demaquillante-avene-limpador-facial/p
Eau Thermale Physiolift Emulsion Lissante Day Avène - Creme Reestruturante - Época Cosméticos - Época Cosméticos,Eau Thermale Physiolift Emulsion Lissante Day Avène - Creme Reestruturante - 30ml,https://www.epocacosmeticos.com.br/eau-thermale-physiolift-emulsion-lissante-day-avene-creme-reestruturante/p
Actine Darrow - Kit Sabonete Líquido - Época Cosméticos,Actine Darrow - Kit Sabonete Líquido - 2x 240ml,https://www.epocacosmeticos.com.br/actine-darrow-kit1-sabonete-liquido/p
Nodé DS+ Shampooing Bioderma - Shampoo Anticaspa - Época Cosméticos - Época Cosméticos,Nodé DS+ Shampooing Bioderma - Shampoo Anticaspa - 125ml,https://www.epocacosmeticos.com.br/node-ds-shampooing-bioderma-shampoo-anticaspa/p
Photoderm Spot Fps 50+ Bioderma - Creme Protetor Solar - Época Cosméticos - Época Cosméticos,Photoderm Spot Fps 50+ Bioderma - Creme Protetor Solar - 30ml,https://www.epocacosmeticos.com.br/photoderm-spot-fps-50-bioderma-creme-protetor-solar/p
Photoderm Max Toque Seco Fps 60 Tinto Bioderma - Protetor Solar - Época Cosméticos - Época Cosméticos,Photoderm Max Toque Seco Fps 60 Tinto Bioderma - Protetor Solar - Dourada,https://www.epocacosmeticos.com.br/photoderm-max-toque-seco-fps-60-tinto-bioderma-protetor-solar/p
