title,product name,url
Bio-Kortex i Futura Biotech - Restruturador Capilar na Black Friday - Época Cosméticos,Bio-Kortex i Futura Biotech - Restruturador Capilar - 15ml,https://www.epocacosmeticos.com.br/bio-kortex-i-futura-biotech-restruturador-capilar/p
Klinse Darrow - Shampoo Neutro - Época Cosméticos - Época Cosméticos,Klinse Darrow - Shampoo Neutro - 140ml,https://www.epocacosmeticos.com.br/klinse-darrow-shampoo-neutro/p
ZeroAK Gel Matificante Dermatus - Tratamento Antiacne - Época Cosméticos,ZeroAK Gel Matificante Dermatus - Tratamento Antiacne - 30g,https://www.epocacosmeticos.com.br/zeroak-gel-matificante-dermatus-tratamento-antiacne/p
Photoplus FPS30 Baby + Sports Dermatus - Época Cosméticos,Photoplus Aderente FPS30 Baby + Sports Dermatus - Protetor Solar - 55g,https://www.epocacosmeticos.com.br/photoplus-aderente-fps30-baby-sports-dermatus-protetor-solar/p
Initase Loção Capilar Dermatus Antiqueda - Época Cosméticos,Initase Loção Capilar Dermatus - Tratamento Antiqueda - 60ml,https://www.epocacosmeticos.com.br/initase-locao-capilar-dermatus-tratamento-antiqueda/p
Desodorante Roll-On Dermatus - Época Cosméticos,Desodorante Antiperspirante Roll-On Dermatus - Desodorante Unissex - 65ml,https://www.epocacosmeticos.com.br/desodorante-antiperspirante-roll-on-dermatus-desodorante-unissex/p
Biopeeling Sérum Facial Biomarine - Rejuvenescedor Facial - Época Cosméticos - Época Cosméticos,Biopeeling Sérum Facial Biomarine - Rejuvenescedor Facial - 30ml,https://www.epocacosmeticos.com.br/biopeeling-serum-facial-biomarine-rejuvenescedor-facial/p
Tensage Day FPS30 Endocare - Rejuvenescedor Facial - Época Cosméticos - Época Cosméticos,Tensage Day FPS30 Endocare - Rejuvenescedor Facial - 40g,https://www.epocacosmeticos.com.br/tensage-day-fps30-endocare-rejuvenescedor-facial/p
Bioliv FPS 53 Futura Biotech - Protetor Solar Facial - Época Cosméticos,Bioliv FPS 53 Futura Biotech - Protetor Solar Facial - Bege Médio,https://www.epocacosmeticos.com.br/bioliv-fps-53-futura-biotech-protetor-solar-facial/p
Duo Retix Cleanser Melora - Limpador Facial - Época Cosméticos,Duo Retix Cleanser Melora - Limpador Facial - 150g,https://www.epocacosmeticos.com.br/duo-retix-cleanser-melora-limpador-facial/p
Skin Active Matrix Support SPF 30 Neostrata - Rejuvenescedor Facial - Época Cosméticos,Skin Active Matrix Support SPF 30 Neostrata - Rejuvenescedor Facial - 50ml,https://www.epocacosmeticos.com.br/skin-active-matrix-support-spf-30-neostrata-rejuvenescedor-facial/p
Estriless Natupele - Tratamento Antiestrias - Época Cosméticos,Estriless Natupele - Tratamento Antiestrias - 4g,https://www.epocacosmeticos.com.br/estriless-natupele-tratamento-antiestrias/p
Ecrinal Vernis Base Anti-Stries - Época Cosméticos,Ecrinal Vernis Base Anti-Stries Ecrinal - Tratamento para Unhas Estriadas - 10ml,https://www.epocacosmeticos.com.br/ecrinal-vernis-base-anti-stries-ecrinal-tratamento-para-unhas-estriadas/p
Cold Cream Crème Mains Avène - Hidratante para as Mãos - Época Cosméticos,Cold Cream Crème Mains Avène - Hidratante para as Mãos - 50ml,https://www.epocacosmeticos.com.br/cold-cream-creme-mains-avene-hidratante-para-as-maos/p
Bio-Kortex Shampoo Reestruturador Futura Biotech - Shampoo Fortalecedor - Época Cosméticos,Bio-Kortex Shampoo Reestruturador Futura Biotech - Shampoo Fortalecedor - 200ml,https://www.epocacosmeticos.com.br/bio-kortex-shampoo-reestruturador-futura-biotech-shampoo-fortalecedor/p
Bio-Kortex Reestruturador Capilar Futura Biotech - Creme Reestruturador Capilar - Época Cosméticos,Bio-Kortex Reestruturador Capilar Futura Biotech - Creme Reestruturador Capilar - 70g,https://www.epocacosmeticos.com.br/bio-kortex-reestruturador-capilar-futura-biotech-creme-reestruturador-capilar/p
Bio-Kortex Condicionador Reestruturador Futura Biotech - Condicionador Reestruturador - Época Cosméticos,Bio-Kortex Condicionador Reestruturador Futura Biotech - Condicionador Reestruturador - 150ml,https://www.epocacosmeticos.com.br/bio-kortex-condicionador-reestruturador-futura-biotech-condicionador-reestruturador/p
Avéne Tolérance Extrême Avène - Tratamento Facial para Peles Sensíveis - Época Cosméticos,Avéne Tolérance Extrême Avène - Tratamento Facial para Peles Sensíveis - 50ml,https://www.epocacosmeticos.com.br/avene-tolerance-extreme-avene-tratamento-facial-para-peles-sensiveis/p
Avène Emulsão Fps 30 Avène - Protetor Solar - Época Cosméticos,Avène Emulsão Fps 30 Avène - Protetor Solar - 50ml,https://www.epocacosmeticos.com.br/avene-emulsao-fps-30-avene-protetor-solar-facial/p
Avène Compacto Fps 50 Avène - Protetor Solar - Época Cosméticos,Avène Compacto Fps 50 Avène - Protetor Solar - Dore,https://www.epocacosmeticos.com.br/avene-compacto-fps-50-avene-protetor-solar/p
Avène Compacto Fps 50 Avène - Protetor Solar - Época Cosméticos,Avène Compacto Fps 50 Avène - Protetor Solar - Sable,https://www.epocacosmeticos.com.br/avene-compacto-fps-50-avene-protetor-solar/p
Vitamin C 5% Lotion Eye Contour Mene & Moy - Rejuvenescedor para o Contorno dos Olhos - Época Cosméticos,Vitamin C 5% Lotion Eye Contour Mene & Moy - Rejuvenescedor para o Contorno dos Olhos - 30ml,https://www.epocacosmeticos.com.br/vitamin-c-5-lotion-eye-contour-mene-moy-rejuvenescedor-para-o-contorno-dos-olhos/p
Tioglic Stick Dia Natupele - Maquiagem Corretiva para Olheiras - Época Cosméticos,Tioglic Stick Dia Natupele - Maquiagem Corretiva para Olheiras - 4g,https://www.epocacosmeticos.com.br/tioglic-stick-dia-natupele-maquiagem-corretiva-para-olheiras/p
Sérénage Serum Avène - Rejuvenescedor Facial - Época Cosméticos,Sérénage Serum Avène - Rejuvenescedor Facial - 30ml,https://www.epocacosmeticos.com.br/serenage-serum-avene-rejuvenescedor-facial/p
Neoptide Loção Antiqueda Ducray - Tônico Antiqueda - Época Cosméticos,Neoptide Loção Antiqueda Ducray - Tônico Antiqueda - 3x 30ml,https://www.epocacosmeticos.com.br/neoptide-locao-antiqueda-ducray-tonico-antiqueda/p
Protetor Solar Minesol Oil Control - Época Cosméticos,Minesol Oil Control Fps 70 Roc - Protetor Solar - 50g,https://www.epocacosmeticos.com.br/minesol-oil-control-fps-70-roc-protetor-solar/p
Minesol Actif Unify Fps 30 Roc - Protetor Solar Facial - Época Cosméticos,Minesol Actif Unify Fps 30 Roc - Protetor Solar Facial - 50g,https://www.epocacosmeticos.com.br/minesol-actif-unify-fps-30-roc-protetor-solar-facial/p
Melanesse Effective Idb Natupele - Creme Clareador da Pele - Época Cosméticos,Melanesse Effective Idb Natupele - Creme Clareador da Pele - 15g,https://www.epocacosmeticos.com.br/melanesse-effective-idb-natupele-creme-clareador-da-pele/p
Hydrass Face Fps 15 Natupele - Hidratante Facial - Época Cosméticos,Hydrass Face Fps 15 Natupele - Hidratante Facial - 150g,https://www.epocacosmeticos.com.br/hydrass-face-fps-15-natupele-hidratante-facial/p
Hydrass Corp Fps 15 Natupele - Hidratante Corporal - Época Cosméticos,Hydrass Corp Fps 15 Natupele - Hidratante Corporal - 245g,https://www.epocacosmeticos.com.br/hydrass-corp-fps-15-natupele-hidratante-corporal/p
Heliocare Max Defense Oil Reduction Gel FPS 30 Heliocare - Protetor Solar Fps 30 - Época Cosméticos,Heliocare Max Defense Oil Reduction Gel FPS 30 Heliocare - Protetor Solar Fps 30 - 50g,https://www.epocacosmeticos.com.br/heliocare-max-defense-oil-reduction-gel-fps30-heliocare-protetor-solar/p
Foaming Glycolic Wash Neostrata - Espuma de Limpeza Facial - Época Cosméticos,Foaming Glycolic Wash Neostrata - Limpador Facial - 100ml,https://www.epocacosmeticos.com.br/foaming-glycolic-wash-neostrata-limpador-facial/p
Face & Body Cleanser Mene & Moy - Higiene Facial e Corporal para Pele Oleosa a Acneica - Época Cosméticos,Face & Body Cleanser Mene & Moy - Higiene Facial e Corporal para Pele Oleosa a Acneica - 150ml,https://www.epocacosmeticos.com.br/face-body-cleanser-mene-moy-higiene-facial-e-corporal-para-pele-oleosa-a-acneica/p
Lenço Micelar Demaquilante Bioderma - Sensibio H2O - Época Cosméticos,Lenço Micelar Demaquilante Bioderma - Sensibio H2O - 25 Unidades,https://www.epocacosmeticos.com.br/lenco-micelar-demaquilante-bioderma-sensibio-h2o/p
Gel Antiacne Mantecorp Skincare - Epidac OC Gel - Época Cosméticos,Gel Antiacne Mantecorp Skincare - Epidac OC Gel - 40g,https://www.epocacosmeticos.com.br/gel-antiacne-mantecorp-skincare-epidac-oc-gel/p
Hidratante Corporal Mantecorp Skincare - Glycare - Época Cosméticos,Hidratante Corporal Mantecorp Skincare - Glycare - 60ml,https://www.epocacosmeticos.com.br/glycare-mantecorp-skincare-hidratante-corporal/p
Shampoo Anticaspa Mantecorp Skincare  Pielus DI - Época Cosméticos,Mantecorp Skincare Pielus DI! - Shampoo Anticaspa - 120ml,https://www.epocacosmeticos.com.br/mantecorp-skincare-pielus-di-shampoo-anticaspa/p
Hidratante Reparador Mantecorp Skincare - Hydraporin - Época Cosméticos,Hidratante Reparador Mantecorp Skincare - Hydraporin - 450g,https://www.epocacosmeticos.com.br/hydraporin-mantecorp-skincare-hidratante-reparador/p
Hidratante Reparador Mantecorp Skincare - Hydraporin - Época Cosméticos,Hidratante Reparador Mantecorp Skincare - Hydraporin - 120g,https://www.epocacosmeticos.com.br/hydraporin-mantecorp-skincare-hidratante-reparador/p
Desodorante Antitranspirante Dermage Unissex - Senskin Deo Aerosol - Época Cosméticos,Desodorante Antitranspirante Dermage Unissex - Senskin Deo Aerosol - 150ml,https://www.epocacosmeticos.com.br/desodorante-antitranspirante-dermage-unissex-senskin-deo-aerosol/p
Hidratante Corporal - Hidramamy - Época Cosméticos,Hidratante Corporal - Hidramamy - 200g,https://www.epocacosmeticos.com.br/hidratante-corporal-hidramamy-/p
Rejuvenescedor - Imecap para Pele - Época Cosméticos,Rejuvenescedor - Imecap para Pele - 60 Capsulas,https://www.epocacosmeticos.com.br/rejuvenescedor-imecap-para-pele/p
Neo Fit Shake Neonutri - Baunilha - Época Cosméticos,Neo Fit Shake Neonutri - Baunilha - 420g,https://www.epocacosmeticos.com.br/neo-fit-shake-neonutri-baunilha/p
Neo Nuts Colágeno Neonutri - Sementes - Época Cosméticos,Neo Nuts Colágeno Neonutri - Sementes - 30g,https://www.epocacosmeticos.com.br/neo-nuts-colageno-neonutri-sementes/p
Suplemento Proteico em Barra Neonutri - Probar Slim Chocolate - Época Cosméticos,Suplemento Proteico em Barra Neonutri - Probar Slim Chocolate - 30g,https://www.epocacosmeticos.com.br/suplemento-proteico-em-barra-neonutri-probar-slim-chocolate/p
Loção Hidratante Corporal Sem Perfume Darrow - SkinSec - Época Cosméticos,Loção Hidratante Corporal Sem Perfume Darrow - SkinSec - 350ml,https://www.epocacosmeticos.com.br/locao-hidratante-corporal-sem-perfume-darrow-skinsec/p
Kit Avène Cleanance - Protetor Solar + Sabonete em Barra - Época Cosméticos,Avène Skinsec Kit - Loção Hidratante + Sabonete em Barra,https://www.epocacosmeticos.com.br/avene-cleanance-kit-protetor-solar-sabonete-em-barra/p
Máscara Descogestionante para Área dos Olhos - Dermatus - Época Cosméticos,Máscara Descogestionante para Área dos Olhos - Dermatus - 70g,https://www.epocacosmeticos.com.br/mascara-descogestionante-para-area-dos-olhos-dermatus/p
Balm de Barba - Go Lúpulo - Época Cosméticos,Balm de Barba - Go Lúpulo - 25g,https://www.epocacosmeticos.com.br/balm-de-barba-go-lupulo/p
Balm de Barba - Go Fresh - Época Cosméticos,Balm de Barba - Go Fresh - 25g,https://www.epocacosmeticos.com.br/balm-de-barba-go-fresh/p
Creme de Hidratação Dermoplex Pés - Época Cosméticos,Creme de Hidratação Dermoplex Pés - 60ml,https://www.epocacosmeticos.com.br/creme-de-hidratacao-dermoplex-pes/p
Repelente de Insetos Dermoplex em Gel - Época Cosméticos,Repelente de Insetos - Dermoplex em Gel - 100ml,https://www.epocacosmeticos.com.br/repelente-de-insetos-dermoplex-em-gel/p
Rejuvenescedor Facial Underskin - Precious Elixir Infusion Colloidal Gold - Época Cosméticos,Rejuvenescedor Facial Underskin - Precious Elixir Infusion Colloidal Gold - 15ml,https://www.epocacosmeticos.com.br/rejuvenescedor-facial-underskin-precious-elixir-infusion-colloidal-gold/p
Hidratante Corporal Darrow SkinSec - Época Cosméticos,Hidratante Corporal Darrow SkinSec - 200ml,https://www.epocacosmeticos.com.br/hidratante-corporal-darrow-skinsec/p
Rejuvenescedor Facial Avène Sérénage Noite - Época Cosméticos,Rejuvenescedor Facial Avène Sérénage Noite - 40ml,https://www.epocacosmeticos.com.br/rejuvenescedor-facial-avene-serenage-noite/p
Máscara Facial Dermatus Oleosidades e Poros Visíveis - Época Cosméticos,Máscara Facial Dermatus Oleosidades e Poros Visíveis - 120g,https://www.epocacosmeticos.com.br/mascara-facial-dermatus-oleosidades-e-poros-visiveis/p
Anti-Idade Natupele Reducline Sérum - Época Cosméticos,Anti-Idade Natupele Reducline Sérum - 30g,https://www.epocacosmeticos.com.br/anti-idade-natupele-reducline-serum/p
Hidratante para Mãos Ada Tina Proteand B5 - Época Cosméticos,Hidratante para Mãos Ada Tina Proteand B5 - 50ml,https://www.epocacosmeticos.com.br/hidratante-para-maos-ada-tina-proteand-b5/p
Amilia Talco Líquido Theraskin - Talco Líquido Corporal - Época Cosméticos,Amilia Talco Líquido Theraskin - Talco Líquido Corporal - 80g,https://www.epocacosmeticos.com.br/amilia-talco-liquido-theraskin-talco-liquido-corporal/p
Apoio Plantar For Her Dr. Scholls - Época Cosméticos,Apoio Plantar For Her Dr. Scholls - 1 Par,https://www.epocacosmeticos.com.br/apoio-plantar-for-her-dr-scholl-s/p
Coppertone Toque Seco Spray FPS 50 Bayer - Protetor Solar - Época Cosméticos,Coppertone Toque Seco Spray FPS 50 Bayer - Protetor Solar - 177ml,https://www.epocacosmeticos.com.br/coppertone-toque-seco-spray-fps-50-bayer-protetor-solar/p
Episol Fps30 Loção Oil Free Episol - Protetor Solar - Época Cosméticos,Episol Fps30 Loção Oil Free Episol - Protetor Solar - 120g,https://www.epocacosmeticos.com.br/episol-fps30-locao-oil-free-episol-protetor-solar-/p
Sensinol Ducray - Shampoo Fisioprotetor - Época Cosméticos - Época Cosméticos,Sensinol Ducray - Shampoo Fisioprotetor - 200ml,https://www.epocacosmeticos.com.br/sensinol-ducray-shampoo-fisioprotetor/p
Kelual DS Ducray - Shampoo para Couro Cabeludo Cescamativo - Época Cosméticos - Época Cosméticos,Kelual DS Ducray - Shampoo para Couro Cabeludo Cescamativo - 100ml,https://www.epocacosmeticos.com.br/kelual-ds-ducray-shampoo-para-couro-cabeludo-descamativo/p
Aquapor Eucerin - Pomada Reparadora - Época Cosméticos - Época Cosméticos,Aquapor Eucerin - Pomada Reparadora - 50g,https://www.epocacosmeticos.com.br/aquapor-eucerin-pomada-reparadora/p
Diet Way Morango Midway - Shake para Redução de Peso - Época Cosméticos - Época Cosméticos,Diet Way Morango Midway - Shake para Redução de Peso - 420g,https://www.epocacosmeticos.com.br/diet-way-morango-midway-shake-para-reducao-de-peso/p
Diet Way Maça e Canela Midway - Shake para Redução de Peso - Época Cosméticos - Época Cosméticos,Diet Way Maça e Canela Midway - Shake para Redução de Peso - 420g,https://www.epocacosmeticos.com.br/diet-way-maca-e-canela-midway-shake-para-reducao-de-peso/p
Chromaway Picolinate Midway - Suplemento à Base de Cromo - Época Cosméticos - Época Cosméticos,Chromaway Picolinate Midway - Suplemento à Base de Cromo - 90 Cápsulas,https://www.epocacosmeticos.com.br/chromaway-picolinate-midway-suplemento-a-base-de-cromo/p
Termolen Equaliv - Suplemento de Cafeína - Época Cosméticos - Época Cosméticos,Termolen Equaliv - Suplemento de Cafeína - 30 Cápsulas,https://www.epocacosmeticos.com.br/termolen-equaliv-suplemento-de-cafeina/p
Ômega 3 Equaliv - Óleo de Peixe - Época Cosméticos - Época Cosméticos,Ômega 3 Equaliv - Óleo de Peixe - 90 Cápsulas,https://www.epocacosmeticos.com.br/omega-3-equaliv-oleo-de-peixe/p
Powerfit Ômega 3 Nutrilatina - Redutor de Triglicerídeos - Época Cosméticos - Época Cosméticos,Powerfit Ômega 3 Nutrilatina - Redutor de Triglicerídeos - 100 Capsúlas,https://www.epocacosmeticos.com.br/powerfit-omega-3-nutrilatina-redutor-de-triglicerideos/p
Dermoabrasivo Cicatricure - Tratamento Para Renovação da Pele - Época Cosméticos,Dermoabrasivo Cicatricure - Tratamento Para Renovação da Pele - Kit,https://www.epocacosmeticos.com.br/dermoabrasivo-cicatricure-tratamento-para-renovacao-da-pele/p
Atoderm Intenssive Gel Moussant Bioderma - Higienizador - Época Cosméticos - Época Cosméticos,Atoderm Intenssive Gel Moussant Bioderma - Higienizador - 200ml,https://www.epocacosmeticos.com.br/atoderm-intenssive-gel-moussant-bioderma-higienizador/p
Protetor Solar Facial Fps 45 Episol Whitegel - Protetor Solar - Época Cosméticos - Época Cosméticos,Protetor Solar Facial Fps 45 Episol Whitegel - Protetor Solar - 60g,https://www.epocacosmeticos.com.br/protetor-solar-facial-fps-45-episol-whitegel-protetor-solar/p
Photoderm Max Toque Seco Fps 60 Bioderma - Protetor Solar - Época Cosméticos - Época Cosméticos,Photoderm Max Toque Seco Fps 60 Bioderma - Protetor Solar - 40ml,https://www.epocacosmeticos.com.br/photoderm-max-toque-seco-fps-60-bioderma-protetor-solar/p
AntiREDNESS Fluido Neutralizante FPS25 Eucerin - Tratamento - Época Cosméticos,AntiREDNESS Fluido Neutralizante FPS25 Eucerin - Tratamento - 50ml,https://www.epocacosmeticos.com.br/antiredness-fluido-neutralizante-fps25-eucerin-tratamento/p
pH5 Syndet Eucerin - Sabonete em Barra - Época Cosméticos,pH5 Syndet Eucerin - Sabonete em Barra - 100g,https://www.epocacosmeticos.com.br/ph5-syndet-eucerin-sabonete-em-barra/p
Rever C 12 Fort Biomarine - Sérum Antivelhecimento - Época Cosméticos - Época Cosméticos,Rever C 12 Fort Biomarine - Sérum Antivelhecimento - 40g,https://www.epocacosmeticos.com.br/rever-c-12-fort-biomarine-serum-antivelhecimento/p
Protetor Solar em Loção Fps30 Actsun - Loção Protetora - Época Cosméticos,Protetor Solar em Loção Fps30 Actsun - Loção Protetora - 120ml,https://www.epocacosmeticos.com.br/protetor-solar-em-locao-fps30-actsun-locao-protetora/p
Óleo de Limpeza Relipidante XeraCalm A.D Avène -  Limpeza Facial para Pele Seca - Época Cosméticos - Época Cosméticos,Óleo de Limpeza Relipidante XeraCalm A.D Avène -  Limpeza Facial para Pele Seca - 100ml,https://www.epocacosmeticos.com.br/oleo-de-limpeza-relipidante-xeracalm-ad-avene/p
Creme Relipidante XeraCalm A.D Avène - Tratamento para Pele Seca - Época Cosméticos - Época Cosméticos,Creme Relipidante XeraCalm A.D Avène - Tratamento para Pele Seca - 200ml,https://www.epocacosmeticos.com.br/creme-relipidante-xeracalm-ad-avene/p
Bálsamo Relipidizante XeraCalm A.D Avène - Tratamento para Pele Seca - Época Cosméticos - Época Cosméticos,Bálsamo Relipidizante XeraCalm A.D Avène - Tratamento para Pele Seca - 200ml,https://www.epocacosmeticos.com.br/balsamo-relipidante-xeracalm-ad-avene/p
Derma Nail Talco Creme Pés Derma Nail - Época Cosméticos,Derma Nail Talco Creme Pés Derma Nail - Tratamento de Odores - 100ml,https://www.epocacosmeticos.com.br/derma-nail-talco-creme-pes-derma-nail-tratamento-de-odores/p
Folcare DS Loção Melora - Loção Anticaspa - Época Cosméticos - Época Cosméticos,Folcare DS Loção Melora - Loção Anticaspa - 50ml,https://www.epocacosmeticos.com.br/folcare-ds-locao-melora-locao-anticaspa/p
Soapelle Darrow - Sabonete em Barra - Época Cosméticos - Época Cosméticos,Soapelle Darrow - Sabonete em Barra - 80g,https://www.epocacosmeticos.com.br/soapelle-darrow-sabonete-em-barra/p
Soapelle Darrow - Sabonete Líquido - Época Cosméticos - Época Cosméticos,Soapelle Darrow - Sabonete Líquido - 140ml,https://www.epocacosmeticos.com.br/soapelle-darrow-sabonete-liquido/p
Brilho Intenso Dermatus - Condicionador Iluminador - Época Cosméticos - Época Cosméticos,Brilho Intenso Dermatus - Condicionador Iluminador - 150g,https://www.epocacosmeticos.com.br/brilho-intenso-dermatus-condicionador-iluminador/p
ZeroAK Sabonete Líquido Dermatus - Época Cosméticos,ZeroAK Sabonete Líquido Dermatus - Tratamento Antiacne - 140ml,https://www.epocacosmeticos.com.br/zeroak-sabonete-liquido-dermatus-tratamento-antiacne/p
Photoplus Stick FPS30 Dermatus - Protetor Solar - Época Cosméticos,Photoplus Stick FPS30 Dermatus - Protetor Solar - 4g,https://www.epocacosmeticos.com.br/photoplus-stick-fps30-dermatus-protetor-solar/p
Initase Dermatus - Shampoo Antiqueda - Época Cosméticos - Época Cosméticos,Initase Dermatus - Shampoo Antiqueda - 120ml,https://www.epocacosmeticos.com.br/initase-dermatus-shampoo-antiqueda/p
Desodorante Antiperspirante Creme Dermatus - Época Cosméticos,Desodorante Antiperspirante Creme Dermatus - Desodorante Unissex - 55g,https://www.epocacosmeticos.com.br/desodorante-antiperspirante-creme-dermatus-desodorante-unissex/p
Derma Clássico Renove Dermatus - Rejuvenescedor Facial - Época Cosméticos - Época Cosméticos,Derma Clássico Renove Dermatus - Rejuvenescedor Facial - 30ml,https://www.epocacosmeticos.com.br/derma-classico-renove-dermatus-rejuvenescedor-facial/p
Derma Clássico Intense Dermatus - Rejuvenescedor Facial - Época Cosméticos,Derma Clássico Intense Dermatus - Rejuvenescedor Facial - 30ml,https://www.epocacosmeticos.com.br/derma-classico-intense-dermatus-rejuvenescedor-facial/p
Skin Plus Fluido Tensor Dermatus - Rejuvenescedor Facial - Época Cosméticos - Época Cosméticos,Skin Plus Fluido Tensor Dermatus - Rejuvenescedor Facial - 30ml,https://www.epocacosmeticos.com.br/skin-plus-fluido-tensor-dermatus-rejuvenescedor-facial/p
Eau Thermale Cicalfate Post-acte Emulsão Reparadora Avène - Tratamento Antivermelhidão - Época Cosméticos - Época Cosméticos,Eau Thermale Cicalfate Post-acte Emulsão Reparadora Avène - Tratamento Antivermelhidão - 40ml,https://www.epocacosmeticos.com.br/eau-thermale-cicalfate-post-acte-emulsao-reparadora-avene-tratamento-antivermelhidao/p
Dermalift Max Biomarine - Rejuvenescedor Facial - Época Cosméticos - Época Cosméticos,Dermalift Max Biomarine - Rejuvenescedor Facial - 30g,https://www.epocacosmeticos.com.br/dermalift-max-biomarine-rejuvenescedor-facial/p
Effaclar Sabonete La Roche Posay - Limpador Facial - Época Cosméticos,Effaclar Sabonete La Roche Posay - Limpador Facial - 70g,https://www.epocacosmeticos.com.br/effaclar-sabonete-la-roche-posay-limpador-facial/p
Complex Up Creme para a Área dos Olhos Dermatus - Rejuvenescedor para o Contorno dos Olhos - Época Cosméticos,Complex Up Creme para a Área dos Olhos Dermatus - Rejuvenescedor para o Contorno dos Olhos - 17g,https://www.epocacosmeticos.com.br/complex-up-creme-para-a-area-dos-olhos-dermatus-rejuvenescedor-para-o-contorno-dos-olhos/p
Clareador da Pele Futura Biotech - Despigmentante - Época Cosméticos,Clareador da Pele Futura Biotech - Despigmentante - 56g,https://www.epocacosmeticos.com.br/clareador-da-pele-futura-biotech-despigmentante/p
Avène 30 Emulsão Toque Seco Color Avène - Protetor Solar - Época Cosméticos,Avène 30 Emulsão Toque Seco Color Avène - Protetor Solar - 50ml,https://www.epocacosmeticos.com.br/avene-30-emulsao-toque-seco-color-avene-protetor-solar/p
Advanced Bruise Skin Renu - Prevention Formula - Época Cosméticos,Advanced Bruise Skin Renu - Prevention Formula - 175ml,https://www.epocacosmeticos.com.br/advanced-bruise-skin-renu-prevention-formula/p
Zeroak - Loção Secativa Dermatus - Pele Acneica - Época Cosméticos,Zeroak - Loção Secativa Dermatus - Pele Acneica - 100ml,https://www.epocacosmeticos.com.br/zeroak-locao-secativa-dermatus-pele-acneica/p
Soless Gel Tonalizante FPS 30 Natupele - Protetor Solar - Época Cosméticos,Soless Gel Tonalizante FPS 30 Natupele - Protetor Solar - Bege bronze,https://www.epocacosmeticos.com.br/soless-gel-tonalizante-fps-30-natupele-protetor-solar/p
Soless Gel Tonalizante FPS 30 Natupele - Protetor Solar - Época Cosméticos,Soless Gel Tonalizante FPS 30 Natupele - Protetor Solar - Bege Claro,https://www.epocacosmeticos.com.br/soless-gel-tonalizante-fps-30-natupele-protetor-solar/p
Soless Gel Tonalizante FPS 30 Natupele - Protetor Solar - Época Cosméticos,Soless Gel Tonalizante FPS 30 Natupele - Protetor Solar - Bege Médio,https://www.epocacosmeticos.com.br/soless-gel-tonalizante-fps-30-natupele-protetor-solar/p
Soless Gel Fps 30 Natupele - Protetor Solar - Época Cosméticos,Soless Gel Fps 30 Natupele - Protetor Solar - 100g,https://www.epocacosmeticos.com.br/soless-gel-fps-30-natupele-protetor-solar/p
Revitalize Dermatus - Rejuvenescedor do Pescoço e Colo - Época Cosméticos,Revitalize Dermatus - Rejuvenescedor do Pescoço e Colo - 70g,https://www.epocacosmeticos.com.br/revitalize-dermatus-rejuvenescedor-do-pescoco-e-colo/p
Lightening Gel Mene & Moy - Gel Facial Despigmentante - Época Cosméticos,Lightening Gel Mene & Moy - Gel Facial Despigmentante - 30ml,https://www.epocacosmeticos.com.br/lightening-gel-mene-moy-gel-facial-despigmentante/p
Intensive Serum W Skin Renu - Rejuvenescedor para o Contorno dos Olhos - Época Cosméticos,Intensive Serum W Skin Renu - Rejuvenescedor para o Contorno dos Olhos - 15ml,https://www.epocacosmeticos.com.br/intensive-serum-w-skin-renu-rejuvenescedor-para-o-contorno-dos-olhos/p
Facial Cleanser Mene & Moy - Limpador Facial - Época Cosméticos,Facial Cleanser Mene & Moy - Limpador Facial - 150ml,https://www.epocacosmeticos.com.br/facial-cleanser-mene-moy-limpador-facial/p
Facial C Masque 10 Mene & Moy - Máscara Facial - Época Cosméticos,Facial C Masque 10 Mene & Moy - Máscara Facial - 50ml,https://www.epocacosmeticos.com.br/facial-c-masque-10-mene-moy-mascara-facial/p
Hidratante Labial Epidrat - Lábios FPS 30 - Época Cosméticos,"Hidratante Labial Epidrat - Lábios FPS 30 - 5,5g",https://www.epocacosmeticos.com.br/hidratante-labial-epidrat-labios-fps-30/p
Suplemento Proteico Albumina Neonutri - Morango e Banana - Época Cosméticos,Suplemento Proteico Albumina Neonutri - Morango e Banana - 500g,https://www.epocacosmeticos.com.br/suplemento-proteico-albumina-neonutri-morango-e-banana/p
